;id;name;city;min_salary;max_salary;company;published_at;experience;schedule;employment;description;conditions;requirement;responsibility;key_skills
56;33909130;Web-разработчик;Екатеринбург;35000.0;45000.0;МКСмедиа;2019-10-18T16:00:15+0300;От 1 года до 3 лет;Полный день;Полная занятость;"MKSmedia – это динамично развивающееся рекламное агентство, с очень амбициозными целями. Наш основной актив – это профессионалы, работающие в команде. В копилке MKSmedia более 100-и постоянных клиентов, более 2 000 успешно реализованных проектов в области SEO, сайтостроения, контекстной рекламы. И сегодня у вас есть отличная возможность влиться в наш коллектив, прокачать себя и неплохо заработать. Напишите в сопроводительном письме почему именно вы должны занять данную должность. В чем ваше преимущества перед другими.   Основные направления нашей деятельности:  Комплексный интернет-маркетинг: создание и продвижение web-проектов в поисковых системах, контекстная реклама (Яндекс.Директ и Google.Adwords), реклама в социальных сетях;    В нашу команду требуется первоклассный Web-программист с желанием развиваться и стремлением зарабатывать.   Наши требования к кандидатам:  Знания HTML5, CSS3 (вёрстка кроссбраузерная и кроссплатформенная); Умение работать с js, ajax, js-фреймворками (jquery); Знание PHP на уровне правок; Опыт работы с системами управления; Умение писать чистый и короткий, семантичный код CSS/HTML; Знание основ СЕО-оптмизации и семантики; Свое письмо вы должны закончить фразой-только вперед ни шагу назад. Способность разобраться в любой CMS; Знание различия браузеров; Способность быстро входить в суть задач и оперативно их реализовывать; Внимательность к деталям, скрупулезность; Опыт работы от года;    Ваши обязанности в рамках компании:  Участие в разработке сайта компании в различной сложности; Управление и техническая поддержка сайта компании; Решите загадку, ответ напишите в сопроводительном письме. У отца Мэри есть 5 дочерей: Чача, Чече, Чичи, Чочо. Как зовут 5 дочь? Верстка макетов, инфографики; Корректировка и добавление информации на сайтах; Доработка и правки на базе программных модулей CMS    Что мы можем предложить:  Идеально для тех, кто хочет реализовать свои навыки и получать за это деньги; Работа удаленная, Вы можете находится в любой точке мира; Официальное трудоустройство, оформление по ТК РФ; График работы: 5/2; Открытость руководства к новым идеям; ";;Знания HTML5, CSS3 (вёрстка кроссбраузерная и кроссплатформенная). Умение работать с js, ajax, js-фреймворками (jquery). Знание PHP на...;Комплексный интернет-маркетинг: создание и продвижение web-проектов в поисковых системах, контекстная реклама (Яндекс.Директ и Google.Adwords), реклама в социальных сетях. ;
64;33965445;Frontend-разработчик (стажер);Ростов-на-Дону;35000.0;45000.0;DONTECO;2019-10-07T21:25:32+0300;Нет опыта;Полный день;Полная занятость;Ищем начинающего Frontend разработчика. Возможно студента ЮФУ или ДГТУ. Готовы обучать, возможен гибкий график для совмещения с учебой. Требуется принимать участие в разработке ряда web-сервисов, преимущественно на Vue.js (маркетплейсы, реклама, финансы). Требования к кандидату:  Знакомство с JavaScript Алгоритмическое мышление Английский на уровне чтения профессиональной литературы Плюсом будет знакомство с Vue.js  Офис в центре города, БЦ Купеческий двор. По результатам стажировки возможно официальное трудоустройство по ТК. Зарплата определяется по результатам собеседования.;;Знакомство с JavaScript. Алгоритмическое мышление. Английский на уровне чтения профессиональной литературы. Плюсом будет знакомство с Vue.js.;;"JavaScript; HTML; CSS"
21;34156570;Помощник программиста 1С;Новосибирск;20000.0;40000.0;НПК Эксперт;2019-10-18T10:41:49+0300;От 1 года до 3 лет;Полный день;Полная занятость;Группа компаний «Эксперт» - динамично развивающийся многопрофильный холдинг. Компания работает на рынке более 15 лет, занимается комплексными поставками комплектующих для радиоэлектронной промышленности, контрактным производством электроники, а также производством систем дистанционного управления освещением. Филиалы компании расположены в городах: Москва, Новосибирск, Томск, Гонконг, Шанхай (КНР). Требования к кандидату:  Общий опыт работы от 1 года Опыт разработки на платформе 1с 8.х будет преимуществом. Ответственность, обучаемость, нацеленность на результат.  Обязанности:  Разработка на платформе 1с 8.2/8.3 Поддержка и сопровождение конфигураций Управление торговлей, Бухгалтерия предприятия, ЗУП Консультирование пользователей.  Условия работы:  Полная/частичная занятость Комфортные условия труда чай, кофе, печеньки за счет компании офис в 10 мин. ходьбы от ст.м. Речной Вокзал ;;Общий опыт работы от 1 года. Опыт разработки на платформе 1с 8.х будет преимуществом. Ответственность, обучаемость, нацеленность на...;Разработка на платформе 1с 8.2/8.3. Поддержка и сопровождение конфигураций Управление торговлей, Бухгалтерия предприятия, ЗУП. Консультирование пользователей.;
3;33753172;Web-программист;Казань;20000.0;40000.0;АйТиПродюс;2019-10-18T19:04:18+0300;Нет опыта;Полный день;Полная занятость;"Обязанности:  Разработка сайтов Обслуживание текущих сайтов разработанных в компании Консультирование клиентов по техническим вопросам  Требования:  Знание 1С-битрикс, Wordpress Хорошее знание HTML и CSS, PHP и JavaScript Навык работы со сторонними библиотеками и сервисами для JavaScript (какминимум, придется иметь дело с jQuery и Yandex Maps API) Умение разбираться в чужом коде и дорабатывать его, не переписывая с нуля(подразумевается работа над проектами, где уже накоплена большая кодоваябаза) Обеспечение защищенности сайтов от взломов и нежелательногоиспользования функционала  Условия:  возможность профессионального и карьерного развития; своевременная оплата труда; обучение; официальное трудоустройство. ";"  возможность профессионального и карьерного развития; своевременная оплата труда; обучение; официальное трудоустройство. ";Знание 1С-битрикс, Wordpress. Хорошее знание HTML и CSS, PHP и JavaScript. Навык работы со сторонними библиотеками и сервисами...;Разработка сайтов. Обслуживание текущих сайтов разработанных в компании. Консультирование клиентов по техническим вопросам.;"jQuery; JavaScript; HTML; CSS; PHP; CMS Wordpress; 1С-Битрикс; Веб-программирование; PHP5; CSS3; HTML5; phpMyAdmin"
19;34103911;Стажёр-программист JavaScript;Москва;25000.0;40000.0;Zecurion;2019-10-18T12:52:25+0300;Нет опыта;Гибкий график;Частичная занятость;В связи с открытием нового направления компания Zecurion, один из крупнейших игроков ИБ‑рынка в сфере разработки систем информационной безопасности, объявляет конкурс на позицию Стажёр-программист JavaScript. DLP-системы Zecurion используются более чем в 10000 организаций в России, СНГ, Европе, США и Азии. Среди наших заказчиков: Allianz-РОСНО, «Аэрофлот», Минфин, «Роснефть», «Сбербанк России», «Ростелеком» и другие. Если Вам интересно участвовать в проектах по разработке принципиально нового и инновационного продукта в сфере кибербезопасности — эта вакансия для Вас! Обязанности:  Участие в написании пользовательского Web-интерфейса. Взаимодействие с QA- департаментом.  Требования:  Знание JavaScript, jQuery. Навык работы с одним из JavaScript-фреймворков: knockoutJS / AngularJS / Backbone.js / Vue.js желателен, но не обязателен :) Наличие опыта разработки приложений даже в рамках учебных проектов будет вашим преимуществом.  Мы предлагаем:  Возможность работать в крутой команде молодых, но очень опытных специалистов. Участвовать в разработке с использованием трендовых инструментов разработки. Достойную заработную плату, которая будет быстро расти вместе со скиллами у успешных стажёров. Страховку в лучших клиниках Москвы и Подмосковья (ДМС). Современный бизнес-центр класса А+ в шаговой доступности от м.ВДНХ. Корпоративные мероприятия, обучение. Офис с кухней, зоной отдыха с PlayStation и пуфиками, чаем, кофе, печеньем и т. д. ;  Возможность работать в крутой команде молодых, но очень опытных специалистов. Участвовать в разработке с использованием трендовых инструментов разработки. Достойную заработную плату, которая будет быстро расти вместе со скиллами у успешных стажёров. Страховку в лучших клиниках Москвы и Подмосковья (ДМС). Современный бизнес-центр класса А+ в шаговой доступности от м.ВДНХ. Корпоративные мероприятия, обучение. Офис с кухней, зоной отдыха с PlayStation и пуфиками, чаем, кофе, печеньем и т. д. ;Знание JavaScript, jQuery. Навык работы с одним из JavaScript-фреймворков: knockoutJS / AngularJS / Backbone.js / Vue.js желателен, но не обязателен :). ;Участие в написании пользовательского Web-интерфейса. Взаимодействие с QA- департаментом.;
7;33790929;Программист;Самара;25000.0;40000.0;777;2019-10-17T13:58:58+0300;От 1 года до 3 лет;Полный день;Полная занятость;"Обязанности :  подключение и настройка оборудования  Поддержка и консультирование пользователей 1С.  Работа с данными (поиск и исправление ошибок, обработка данных, участие в переносах и проверке данных).  Создание пользовательских инструкций для разрабатываемых и поддерживаемых ИС   Создание отчетов и обработок для оперативного получения/изменения информации в БД.   Локализация, исправление ошибок в штатном функционале.   Поддержка интеграционных механизмов со смежными системами.   Требования:  Практический опыт по самостоятельному поиску решения проблем пользователей при каждодневном использовании ими систем 1С. Умение читать чужой код Навык разработки приложений на платформе 1С не мене уровня написания логики обработок данных и формирования запросов для получения данных. Знание платформы 1С и опыт разработки под клиент-серверную архитектуру и управляемые формы Опыт работы и разработки на базе конфигурации 1С: Бухгалтерия Предприятия 3.0,1С Розница Работа по интеграции с другими учетными системами на платформе 1С.  Условия:  официальное трудоустройство; своевременная выплата заработной платы ";"  официальное трудоустройство; своевременная выплата заработной платы ";Практический опыт по самостоятельному поиску решения проблем пользователей при каждодневном использовании ими систем 1С. Умение читать чужой код. ;Подключение и настройка оборудования. Поддержка и консультирование пользователей 1С. Работа с данными (поиск и исправление ошибок, обработка данных, участие...;"1С: Комплексная автоматизация; 1С: Торговля; Настройка сетевых подключений; Торговля; 1С: Розница; 1С программирование"
21;33571697;Начинающий android разработчик;Челябинск;25000.0;40000.0;СофтПлюс;2019-10-17T00:02:13+0300;Нет опыта;Полный день;Полная занятость;"Требования– Крепкие знания основ Java и Android;– Опыт работы с с Activity и Service;– Работа в офисе в Челябинске: удалёнки на постоянной основе нет, иногда можно поработать из дома. С нами вы освоите– Retrofit;– GSON;– Picasso;– Stetho;– Mockito;– JUnit;– Espresso;– Farebase;– Swift, по желанию;– применять на практике принципы SOLID и MVP. Учиться предстоит, в основном, самостоятельно, при поддержке опытной команды и с возможностью получать консультации у лучших экспертов Челябинска. Задачи службыРазработка мобильных приложений для проектов zaycev.net, zaycev.fm, mp3.ru, mursic.ru на платформах Android и iOS, включая AndroidTV, Wear OS. В будущем - AppleTV, Android Auto, CarPlay. Условия– Офис открыт с 08.00 до 22.00, выберите своё время работы самостоятельно.– С вас - качество работ, с нас - информация и оборудование по запросу.– Оплачиваем образование: курсы и профильные конференции.– Работаем без жестких дедлайнов и KPI.– Есть возможность договориться о зарплате выше чем у обычного Junior, учитывая ваш опыт.";;Крепкие знания основ Java и Android. – Опыт работы с с Activity и Service. – JUnit. – Swift, по желанию. – применять на практике...;С вас - качество работ, с нас - информация и оборудование по запросу.;"Java; Android"
16;33910347;Программист-стажер 1С;Москва;30000.0;40000.0;Инокспоинт Групп;2019-10-18T16:45:03+0300;Нет опыта;Полный день;Полная занятость;Инокспоинт Групп – крупнейший национальный металлотрейдер, специализирующийся на поставках нержавеющего металлопроката и комплектующих. В нашу команду открыт набор на должность «Программист-стажер 1С» Что необходимо делать:  Участвовать в доработке существующей конфигурации 1С «Управление торговлей 8.3» Поддерживать пользователей (обрабатывать телефонные обращения сотрудников компании по вопросам, связанным с работой 1С, уточнять детали и выявлять проблемы, формировать/ корректировать задачи на основе данных обращений)  Кого мы ищем:  Кандидатов, которые интересуются программированием в среде 1С Имеющих высшее техническое или экономическое образование Знающих основы производственного, бухгалтерского и налогового учета Готовых к обучению и обработке большого объема информации Знание web-технологий будет являться преимуществом  Что вы получаете, работая у нас:  Обучение и поддержку от более опытных коллег Трудоустройство по ТК - 100% белая компания Заработная плата обсуждается по итогам собеседования Молодой и дружный коллектив (средний возраст 25-35 лет), приятным бонусом станут выезды и корпоративные мероприятия Удобное расположение офиса вблизи станции метро Таганская График работы с понедельника по пятницу с 9.00 до 17.00 ;;Кандидатов, которые интересуются программированием в среде 1С. Имеющих высшее техническое или экономическое образование. Знающих основы производственного, бухгалтерского и налогового...;Участвовать в доработке существующей конфигурации 1С «Управление торговлей 8.3». Поддерживать пользователей (обрабатывать телефонные обращения сотрудников компании по вопросам...;"1С программирование; 1С: Управление Торговлей; Веб-программирование; Базы данных; Пользователь ПК; 1С: Управление предприятием; 1С: Предприятие 8; Клиентоориентированность; Стрессоустойчивость"
38;34101611;Специалист отдела снабжения/программист;Москва;30000.0;40000.0;Дедал-НВ;2019-10-18T16:01:53+0300;От 1 года до 3 лет;Полный день;Полная занятость;Обязанности: Участие в автоматизации бизнес-процессов компании на базе 1С УНФ: -Поддержка и доработка конфигурации 1С УНФ. -Администрирование баз данных, настройка ролей и прав пользователей. -Настройка и оптимизация интерфейсов пользователей. Доставка документации по Москве. Работа со складом. Требования: Техническое образование (Возможно, студент) Владение программированием в среде 1С:Предприятие 8.3 Желание найти приложение своим знаниям в практической деятельности Стремление к дальнейшему обучению и профессиональному росту.   Условия: Постоянная занятость Оформление в соответствии с ТК РФ Заработная плата по результатам собеседования.  ; Постоянная занятость Оформление в соответствии с ТК РФ Заработная плата по результатам собеседования.  ;Техническое образование (Возможно, студент). Владение программированием в среде 1С:Предприятие 8.3. Желание найти приложение своим знаниям в практической...;Участие в автоматизации бизнес-процессов компании на базе 1С УНФ: -Поддержка и доработка конфигурации 1С УНФ. -;"1С: Предприятие 8; 1С: Документооборот; Базы данных"
