;id;name;city;min_salary;max_salary;company;published_at;experience;schedule;employment;description;conditions;requirement;responsibility;key_skills
31;33631099;Программист;Тюмень;40000.0;55000.0;ГАУ ТО ЦЗН города Тюмени и Тюменского района;2019-10-18T07:03:17+0300;Нет опыта;Полный день;Полная занятость;"Обязанности:   Ваша работа будет заключаться в ... - Консультации пользователей по вопросам работы в программных продуктах 1С (УПП, Бухгалтерия, ЗУП); - Программировании и доработке конфигураций 1С в соответствии с техническими заданиями; - Мониторинге выхода новых типовых конфигураций необходимых для обновления программ на базе 1С, контроль изменений в новых конфигурациях; - Разработке конфигурации в 1С по представленным техническим заданиям других отделов и подразделений предприятия.  Требования:   нет требований к стажу Работа с компьютером на профессиональном уровне Эта работа для Вас если… - Вы имеете высшее техническое образование; - Умеете проектировать информационные системы и базы данных, владеть встроенным языком программирования 1С, имеете опыт программирования в иных формализованных языках программирования; - Ориентируетесь в основных конфигурациях 1С связанных с функционированием средних и крупных предприятий; - Знаете устройство и принципы работы операционных систем и компьютерной техники; - Умеете работать в режиме многозадачности.   Условия:   Пятидневная рабочая неделя с 8-00 до 17-00   оформление в рамках трудового законодательства   Повременно-премиальная оплата труда  Адрес рабочего места: рп Винзили, р-н Тюменский, ул Вокзальная развозка людей питание в столовой обучение за счет работодателя вакансия рассматривается по результатам изучения резюме ";   Пятидневная рабочая неделя с 8-00 до 17-00   оформление в рамках трудового законодательства   Повременно-премиальная оплата труда  Адрес рабочего места: рп Винзили, р-н Тюменский, ул Вокзальная развозка людей питание в столовой обучение за счет работодателя вакансия рассматривается по результатам изучения резюме ;Нет требований к стажу. Работа с компьютером на профессиональном уровне. Эта работа для Вас если…. - Вы имеете высшее техническое образование. - ;Ваша работа будет заключаться в ... - Консультации пользователей по вопросам работы в программных продуктах 1С (УПП, Бухгалтерия, ЗУП). - ;
31;33672941;Программист 1С;Омск;20000.0;50000.0;Ядрышников Игорь Борисович;2019-09-19T13:18:19+0300;От 1 года до 3 лет;Удаленная работа;Частичная занятость;"Обязанности:  Обновление и доработка конфигураций 1С, в том числе не типовых. Консультирование пользователей  Требования:  Опыт работы с конфигурациями Управление торговлей, Бухгалтерия, Розница, Зарплата и управление персоналом; Знание основ бухгалтерского, кадрового и управленческого учета. Умение писать код для обычных и управляемых форм. Знание механизма конвертации данных.  Условия:  Удаленная работа, при необходимости работа в офисе. ";  Удаленная работа, при необходимости работа в офисе. ;Опыт работы с конфигурациями Управление торговлей, Бухгалтерия, Розница, Зарплата и управление персоналом. Знание основ бухгалтерского, кадрового и управленческого учета. ;Обновление и доработка конфигураций 1С, в том числе не типовых. Консультирование пользователей.;
58;34131984;Frontend-разработчик;Ростов-на-Дону;25000.0;50000.0;Южная маркетинговая компания;2019-10-17T09:20:10+0300;От 1 года до 3 лет;Полный день;Полная занятость;"В нашу креативную команду требуется Frontend-разработчик, умеющий брать на себя ответственность за поставленные задачи и за достигнутый результат. ООО «Южная маркетинговая компания»Основана в августе 2014 года.Более 100 выполненных проектов по России.Основным направлением компании является создание и продвижение сайтов, маркетинговый анализ и построение маркетинговой стратегии. Присоединяйтесь к нам! Основные задачи: · Верстка по стандартам; · Аптивная верстка; · Оптимизация и рефакторинг кода.   Это потребует следующих знаний и умений: · Знание HTML, CSS, Jquery, Ajax, Bootstrap; · Умение верстать сложные макеты Figma/Sketch/Photoshop; · Знание адаптивной верстки документов, валидной и кроссбраузерной верстки; · Знание систем контроля версий (git);   Также будет неплохо, если Вы владеете: · ModX.   Взамен мы можем предложить: · Возможность внести свой вклад в развитие компании; · Множество любопытных задач, сложных проблем и увлекательных головоломок; · Классные специалисты (и просто интересные люди) с многолетним опытом; · Гарантия карьерного и профессионального роста; · Оформление по ТК РФ; · Заработная плата: высокая, обсуждается с каждым кандидатом индивидуально в зависимости от опыта работы; · График 5/2, cб., вс. – выходные дни; · Время работы с 10.00-19.00; · Корпоративное обучение; · Уютный офис (свежий кофе и фрукты для настроения);  ";;Это потребует следующих знаний и умений: Знание HTML, CSS, Jquery, Ajax, Bootstrap. Умение верстать сложные макеты Figma/Sketch/Photoshop. ;Основным направлением компании является создание и продвижение сайтов, маркетинговый анализ и построение маркетинговой стратегии. Верстка по стандартам. Аптивная верстка. ;
55;33325596;Начинающий Javascript разработчик;Челябинск;25000.0;50000.0;СофтПлюс;2019-10-18T00:08:13+0300;От 1 года до 3 лет;Полный день;Полная занятость;"Требования– Умеете верстать (html+css) и писать простые скрипты на js;– Можете прочесть (с помощью goolge) php код, внести минимальные правки и сформировать SQL запрос к базе. У нас вы научитесь– Пользоваться webpack;– Освоите и React, и Vue, и Angular, и разработку на чистом JS;– Вносить правки и доработки на backend (node.js и php);– Работать со сверхбыстрой БД ClickHouse от Яндекс;– Обеспечивать безопасность продукта с HashiCorp(Consul, Vault);– Строить сервисную архитектуру и пользоваться очередями RabbitMQ;– Настраивать мониторинг на Prometheus и Graphite. Условия– Офис открыт с 08.00 до 22.00, выберите своё время работы самостоятельно;– С вас - качество работ, с нас - информация и оборудование по запросу;– Оплачиваем образование: курсы и профильные конференции;– Работаем без KPI. Zaycev.FM – одна из первых интернет станций в Рунете, существует с 2010 г. Работает без стационарной студии.Занимаемся различными музыкальными проектами стриминга (интернет вещания): от интернет-радио, до интеллектуального музыкального помощника - рекомендательной сети на исскуственном интелекте. Стек основных технологий: php, node.js, MySQL. В разных проектах использованы React, Vue.js и Angular 6. Стремимся внедрить CI/CD на 100% проектов. Команда разработки трудится в офисе в Челябинске.";;Умеете верстать (html+css) и писать простые скрипты на js. – Оплачиваем образование: курсы и профильные конференции.;Можете прочесть (с помощью goolge) php код, внести минимальные правки и сформировать SQL запрос к базе. – Освоите и React, и...;"JavaScript; HTML; CSS3"
99;31655667;Программист 1С / Программист-стажер 1C;Челябинск;25000.0;50000.0;Сатурн-2;2019-10-14T10:05:45+0300;Нет опыта;Полный день;Полная занятость;"  Группа компаний Сатурн - это крупное и стабильное предприятие автобизнеса, которое занимает устойчивые позиции на рынке более 16-ти лет. Мы являемся официальными дилерами автомобильных брендов RENAULT, SUZUKI, LADA, LIFAN, GM. Мы открыли 7 дилерских центров в г. Челябинске и Миассе. На нашем предприятии трудятся более 450 сотрудников. В связи с расширением объемов и производственных показателей, приглашаем на работу на вакансию Специалист службы разработки 1С, программист 1С.   Обязанности:  Разработка и развитие функционала системы Техническая сопровождение системы 1С: Альфа-Авто Администрирование базы (создание, редактирование учетных записей пользователей, настройка прав доступа, блокировка) Устранение ошибок в электронном документообороте по запросам пользователей Контроль корректности ведения базы (справочники, журналы документов)   Участие в написании инструкций для пользователей  Требования:  Знание продуктов 1С: Предприятие 8.3 на уровне разработчика; Умение работать в команде; Активная жизненная позиция, аналитические способности, коммуникативные навыки, работоспособность, ответственность, инициативность  Дополнительными преимуществами при рассмотрении вашей кандидатуры будут:  Знание конфигурации 1С: Альфа-Авто 5 Знание конфигураций 1С: Бухгалтерия, 1С: ЗУП Наличие сертификатов 1С Опыт работы с торговым оборудованием  Условия:  Работа в составе профессиональной команды; Хорошие возможности обучения, профессионального и карьерного развития по специальности График работы 5/2 (Пн-Пт); Оплачиваемый отпуск; Официальное трудоустройство в штат компании строго в соответствии с ТК РФ; Скидки на покупку авто брендов компании и сервисное обслуживание; Компенсация занятий спортом; И тд       ";"  Работа в составе профессиональной команды; Хорошие возможности обучения, профессионального и карьерного развития по специальности График работы 5/2 (Пн-Пт); Оплачиваемый отпуск; Официальное трудоустройство в штат компании строго в соответствии с ТК РФ; Скидки на покупку авто брендов компании и сервисное обслуживание; Компенсация занятий спортом; И тд       ";Знание продуктов 1С: Предприятие 8.3 на уровне <highlighttext>разработчика</highlighttext>. Умение работать в команде. Активная жизненная позиция, аналитические способности, коммуникативные...;Разработка и развитие функционала системы. Техническая сопровождение системы 1С: Альфа-Авто. Администрирование базы (создание, редактирование учетных записей пользователей, настройка...;"1С программирование; 1С: Документооборот; 1С: Предприятие 8; 1С: Зарплата и управление персоналом; 1С: Торговля; 1С: Склад; Пользователь ПК"
14;34169924;Web программист / веб-разработчик;Санкт-Петербург;30000.0;50000.0;ProfitKit;2019-10-18T19:15:18+0300;От 1 года до 3 лет;Полный день;Полная занятость;"Web программист / Html-верстальщик / Веб-разработчик Компания Профиткит ищет php разработчиков junior и middle уровня. Наша компания занимается созданием продающих сайтов, сервисов и интернет-магазинов. У нас много проектов со сложными интеграциями и интересной логикой. Скучно не будет. Мы рассмотрим кандидатов разного уровня подготовленности и предложим условия соответствующие Вашим знаниями и умениям. Обязанности:  Верстка сайтов; Веб-разработка;    Требования:  Знание HTML, CSS, jQuery, PHP, Mysql; Опыт разработки сайтов; Опыт верстки perfect pixel проектов; Опыт создания и доработки сайтов на любой CMS (1С-Битрикс, OpenCart, WordPress, Webasyst); Способность мыслить аналитически; Умение планировать свое время (на день, неделю, месяц) и учитывать время коллег, расставлять приоритеты, соблюдать сроки; Желание учиться новому Исполнительность, ответственность, педантичность;    Условия:  Работа в молодом профессиональном коллективе; Оплачиваемый отпуск, больничные; Место работы: ст. метро пл. Александра Невского (бесплатная развозка на автобусе); График работы: 10:00 до 19:00 (обсуждается); Мы предлагаем:  Интересные функционирующие и разрабатываемые проекты; Постоянное повышение уровня квалификации (обучение, сертификаты) за счет компании; Перспективные собственные проекты; Быстрый карьерный рост;   ";"  Интересные функционирующие и разрабатываемые проекты; Постоянное повышение уровня квалификации (обучение, сертификаты) за счет компании; Перспективные собственные проекты; Быстрый карьерный рост;   ";"Знание HTML, CSS, jQuery, PHP, Mysql. Опыт разработки сайтов. Опыт верстки &quot;perfect pixel&quot; проектов. Опыт создания и доработки сайтов на...";Верстка сайтов. Веб-разработка.;"HTML; CSS; PHP; jQuery; 1С-Битрикс; CMS Wordpress; Веб-программирование; Верстка; MySQL; CSS3; HTML5"
