;id;name;city;min_salary;max_salary;company;published_at;experience;schedule;employment;description;conditions;requirement;responsibility;key_skills
72;33868048;Веб-разработчик;Новосибирск;45000.0;50000.0;АС Менеджмент Групп, Кадровое Агентство ключевых специалистов;2019-10-17T12:33:18+0300;От 1 года до 3 лет;Полный день;Полная занятость;"Обязанности: Подбор и размещение на веб-странице визуалов в заданном стиле (картинки, пиктограммы и др.); Разработкой графического контента для сайтов Визуальной контента для соц. сетей и рассылки Координация работы сайтов - 3 шт. Проверка работоспособности сайтов Контроль баланса хостинга Контроль свободного места на хостинге Чистка устаревшего кеша сайта, при необходимости Архивация сайтов Тестирование скорости, отклика и др. параметров сайтов Настройка логики модулей доставки Настройка логики модулей оплаты Заказ, по мере устаревания, сертификатов безопасности для сайта Систематизация новых данных интернет-магазина, реквизитов, значений для фильтров Выявление позиций без цен и фотографий Разработка функционала, поддержка, контроль и оптимизация существующих проектов Кастомизация шаблонов компонентов Битрикс Самостоятельная разработка и доработка проектов (сайт) и сервисов на основе CMS 1C-Битрикс Разработка посадочных страниц (landing page). Интегрирование сторонних модулей для улучшения работы сайта Техническое сопровождение и доработка существующих сайтов Оптимизация сайта с точки зрения юзабилити Поддерживать работоспособность сайта Пополнение сайта контентом (товары, изображения, слайдеры) Поддержание актуальной информации на сайте (цены, акции и т.д.), отображение действующих акций на сайте, разработка баннеров под них Настройка аналитических систем для обработки данных о посещениях сайтов (Google Analytics, Yandex Metrika, Google Tag Manager); Настройка отслеживания звонков с сайтов; Анализ эффективности рекламных мероприятий (владение инструментами аналитики Яндекс. Метрика и Google.Analytics, работа с показателями аналитики по звонкам, обращениям, первичным и повторным посещениям). Анализ данных сайта, сбор отчетности, написание логических выводов и рекомендаций для увеличения бизнес-показателей; Работа с полным комплексом интернет-рекламы (понимание инструментов, стратегия и планирование, контроль деятельности подрядчика). Контроль наполнения и обновления сайта и других информационных ресурсов, с информацией о компании. Требования: Опыт аналогичной деятельности, от 6 месяцев Условия: Заработная плата: 45000 - 50000.00рр. Место работы: Центральный район, ориентир, ст. м. Маршала Покрышкина. Пятидневная рабочая неделя, Пн. - ПТ., с 09.00. до 18.00. Крупное торговое предприятие.  "; Заработная плата: 45000 - 50000.00рр. Место работы: Центральный район, ориентир, ст. м. Маршала Покрышкина. Пятидневная рабочая неделя, Пн. - ПТ., с 09.00. до 18.00. Крупное торговое предприятие.  ;Опыт аналогичной деятельности, от 6 месяцев.;Подбор и размещение на веб-странице визуалов в заданном стиле (картинки, пиктограммы и др.). Разработкой графического контента для сайтов. ;"Ведение групп в социальных сетях; HTML; Adobe Photoshop; Яндекс.Метрика; CSS"
32;34162621;Инженер-программист (ЧПУ);Омск;45000.0;50000.0;ПК Вектор;2019-10-18T13:49:20+0300;От 1 года до 3 лет;Полный день;Полная занятость;Обязанности:  Написание и отработка программ для станков с ЧПУ.Знание и умение работать с инструментом. Ведение участка.  Требования:  Опыт работы в сфере металлообработки. Знание всех сопутствующих программ.  Условия:  Все условия после собеседования. ;  Все условия после собеседования. ;Написание и отработка программ для станков с ЧПУ.Знание и умение работать с инструментом. Опыт работы в сфере металлообработки. ;Ведение участка.;
48;33847447;Разработчик 1С;Ростов-на-Дону;45000.0;50000.0;Информ-Групп, РИЦ;2019-10-16T09:07:43+0300;Нет опыта;Полный день;Полная занятость;Наша компания занимается сопровождением и продажей справочно-правовых систем Консультант Плюс, и нам в команду IT требуется программист 1С для решения задач по автоматизации. Требования:  Уверенное знание возможностей платформы, языка запросов, СКД, веб-сервисы, КД Знакомство с 1С:Бухгалтерия 2 и 3, 1С:Зарплата 2.5 и 3, 1С:Управление торговлей 10 и 11 Приветствуется опыт работы с PostgreSQL, MS SQL Исполнительность, ответственность  Условия:  Работа в команде Комфортный офис в центре, кофемашина Оформление по ТК РФ   ;  Работа в команде Комфортный офис в центре, кофемашина Оформление по ТК РФ   ;Уверенное знание возможностей платформы, языка запросов, СКД, веб-сервисы, КД. Знакомство с 1С:Бухгалтерия 2 и 3, 1С...;;"1С: Бухгалтерия; 1С: Управление Торговлей; 1С программирование; 1С: Управление персоналом; Cистемы управления базами данных"
64;34023904;Программист 1С;Челябинск;45000.0;50000.0;ГК Уралкран;2019-10-17T12:21:14+0300;От 1 года до 3 лет;Полный день;Полная занятость;"Обязанности: 1. Выполнение проекта по автоматизации предприятия на базе продуктов 1С: CRM, 1C: ERP, 1С: Документооборот. 2. Разработка правил обмена между различными конфигурациями 1С. 3. Подготовка пакета документации на программные разработки. 4. Поддержка пользователей предприятия. Требования: Знание типовых конфигураций 1С: Бухгалтерия предприятия, 1С: ЗУП, 1С: Документооборот. Знание продукта 1C: ERP будет являться преимуществом. Результативность (способность достигать поставленной цели), готовность к изменениям под требования руководителя, способность решить задачу так, чтобы потом не переделывать, способность разобраться в вопросе, даже при отсутствии явных знаний. Условия:  Официальное трудоустройство, белая заработная плата, стабильные выплаты на карту 2 раза в месяц; График работы: пятидневная рабочая неделя, с 8:30 до 17:30; Работа в крупной стабильной Компании; Работа в команде профессионалов, готовых поделиться своими знаниями и научиться чему- то новому у вас; Возможность профессионального и карьерного роста!   ";"  Официальное трудоустройство, белая заработная плата, стабильные выплаты на карту 2 раза в месяц; График работы: пятидневная рабочая неделя, с 8:30 до 17:30; Работа в крупной стабильной Компании; Работа в команде профессионалов, готовых поделиться своими знаниями и научиться чему- то новому у вас; Возможность профессионального и карьерного роста!   ";Знание типовых конфигураций 1С: Бухгалтерия предприятия, 1С: ЗУП, 1С: Документооборот. Знание продукта 1C: ERP будет являться...;1. Выполнение проекта по автоматизации предприятия на базе продуктов 1С: CRM, 1C: ERP, 1С: Документооборот. 2. ;
51;33867749;Программист микроконтроллеров SMT32+SIM800;Казань;50000.0;50000.0;ПромБудущее;2019-10-01T22:20:31+0300;От 1 года до 3 лет;Удаленная работа;Частичная занятость;Обязанности:  Программирование SMT32 с доступом к серверу через SIM800, используя SSL и PPP Организация быстрого SSL-соединения устройства с сервером используя PPP Область деятельности: создание/дорабока функционала контроллера для вендингового оборудования (торговых автоматов)  Требования:  Опыт работы с STM32 и SIM800 Уверенное знание сетевых технологий (сокеты, PPP, lwip) Уверенное знание шифрования (SSL/TLS, RSA, AES, SHA256, CA, PKI) Желателен опыт работы с NFC  Условия:  возможна удаленная работа и частичная занятость ;  возможна удаленная работа и частичная занятость ;Опыт работы с STM32 и SIM800. Уверенное знание сетевых технологий (сокеты, PPP, lwip). Уверенное знание шифрования (SSL/TLS...;Программирование SMT32 с доступом к серверу через SIM800, используя SSL и PPP. Организация быстрого SSL-соединения устройства с...;"Assembler; C/C++; STM32"
67;33776222;Программист С/С++ микроконтроллеров TI (MSP430, CC1310, CC3220);Казань;50000.0;50000.0;ПромБудущее;2019-09-25T21:27:31+0300;От 1 года до 3 лет;Удаленная работа;Частичная занятость;Обязанности:   Программирование на С/С++   Развитие существующих и создание новых устройств телеметрии со сверхнизким энергопотреблением и малыми габаритами   Работа с чипами cc1310, cc3220, MSP430, SIM800 и др.   Требования:  Уверенное знание С/С++ Уверенное знание сетевых технологий (сокеты, http, SSL) Опыт работы с чипами TI (IDE: Code Composer Studio, OS: Posix и TI-RTOS) Понимание принципов работы РЭА Желательно: опыт работы с NFC, вендинговым оборудованием  Условия:  Возможна удаленная работа Неполная занятость ;  Возможна удаленная работа Неполная занятость ;Уверенное знание С/С++. Уверенное знание сетевых технологий (сокеты, http, SSL). Опыт работы с чипами TI (IDE: Code Composer Studio...;Программирование на С/С++. Развитие существующих и создание новых устройств телеметрии со сверхнизким энергопотреблением и малыми габаритами. Работа с чипами...;"Assembler; C/C++"
22;33631644;Программист 1С;Челябинск;50000.0;50000.0;Форпост;2019-10-14T07:31:03+0300;От 1 года до 3 лет;Полный день;Полная занятость;"Крупный дистрибьютор Уральского региона приглашает на постоянную работу программиста 1С. ( новая штатная единица в связи с увеличением объема работ)   Условия:  график работы: 5-ти дневная рабочая неделя, с 9:00 до 18:00; трудоустройство в соответствии с ТК РФ; заработная плата индивидуально обсуждается с кандидатом на собеседовании; рабочее место – ул. Радонежская, 15 (доставка служебным транспортом).    Обязанности:  поддержка конфигураций на базе 1С: Управление торговлей ред. 11.2 и других. глубокая модернизация существующих систем на базе 1С. разработка новых отчетов, доработка старых. поддержка многочисленных обменов, различных форматов выполнение задач по программированию на основе ТЗ.    Требования:  высшее образование; опыт работы от 1 года; профессиональное программирование на платформе 1С Предприятие; нацеленность на результат; внимательность; ответственность. ";"  график работы: 5-ти дневная рабочая неделя, с 9:00 до 18:00; трудоустройство в соответствии с ТК РФ; заработная плата индивидуально обсуждается с кандидатом на собеседовании; рабочее место – ул. Радонежская, 15 (доставка служебным транспортом).    Обязанности:  поддержка конфигураций на базе 1С: Управление торговлей ред. 11.2 и других. глубокая модернизация существующих систем на базе 1С. разработка новых отчетов, доработка старых. поддержка многочисленных обменов, различных форматов выполнение задач по программированию на основе ТЗ.    Требования:  высшее образование; опыт работы от 1 года; профессиональное программирование на платформе 1С Предприятие; нацеленность на результат; внимательность; ответственность. ";Высшее образование. Опыт работы от 1 года. Профессиональное программирование на платформе 1С Предприятие. Нацеленность на результат. Внимательность. Ответственность.;Поддержка конфигураций на базе 1С: Управление торговлей ред. 11.2 и других. Глубокая модернизация существующих систем на базе 1...;
88;34032063;Стажер-программист C#;Москва;;50000.0;НЕОЛАНТ;2019-10-16T19:21:03+0300;От 1 года до 3 лет;Полный день;Полная занятость;«НЕОЛАНТ», крупная IT- и инжиниринговая компания, разработчик инновационных решений и поставщик инжиниринговых и IT-услуг для атомного, добывающего, топливно-энергетического комплексов России, органов государственного и муниципального управления ищет специалиста на вакансию «Программист C#» в отдел интеграционных решений. Обязанности:  Разработка программных продуктов на языке C# Доработка существующих решений с использованием API Написание эксплуатационной/сервисной документации под разрабатываемый софт  Требования:  Образование: студент старших курсов ВУЗов технических специальностей/молодой специалист/опыт 1-3 года Опыт реальной разработки на C#/VBA, Навыки написания аккуратного, работающего, поддерживаемого кода Желание разбираться с «чужим» кодом Понимание и опыт реального применения принципов ООП Базовые знания SQL и принципов работы СУБД Открытость к новому, готовность к обучению  Требования к личным характеристикам и качествам:  Аналитический склад ума Желание учиться, развиваться и приобретать новые навыки Готовность работать в команде, общаться с коллегами  Условия:  Интересная и стабильная работа в динамично развивающейся компании Дружественная атмосфера Оформление по ТК Возможен гибкий график работы, совмещение с учебой Широкое поле для профессионального и карьерного роста Корпоративное обучение Чай/кофе/кикер/настольный теннис в офисе Офис в современном бизнес-центре класса B+. Расположение между метро Курская, Красные ворота, Комсомольская, Тургеневская – в пешей доступности от 4 вокзалов. Адрес: ул. Покровка, Возможны командировки ;  Интересная и стабильная работа в динамично развивающейся компании Дружественная атмосфера Оформление по ТК Возможен гибкий график работы, совмещение с учебой Широкое поле для профессионального и карьерного роста Корпоративное обучение Чай/кофе/кикер/настольный теннис в офисе Офис в современном бизнес-центре класса B+. Расположение между метро Курская, Красные ворота, Комсомольская, Тургеневская – в пешей доступности от 4 вокзалов. Адрес: ул. Покровка, Возможны командировки ;Образование: студент старших курсов ВУЗов технических специальностей/молодой специалист/опыт 1-3 года. Опыт реальной разработки на C#/VBA. ;Разработка программных продуктов на языке C#. Доработка существующих решений с использованием API. Написание эксплуатационной/сервисной документации под разрабатываемый софт.;"VBA; SQL; ООП; C#"
