;name;city;min_salary;max_salary;company;published_at;min_experience;max_experience;schedule;employment;description;conditions;requirement;responsibility;key_skills
17;Стажер-программист 1С;Ижевск;;;1С-ИжТиСи;2019-09-26T14:11:07+0300;0;0;Полный день;Стажировка;"Мы - Компания 1С ИжТиСи, дочернее предприятие фирмы 1С. Сопровождаем, обновляем и оптимизируем нетиповые конфигурации 1С. Мы - лучшие в этом направлении деятельности в России и СНГ БЕСПЛАТНАЯ СТАЖИРОВКА для будущих программистов 1С Мы ждем:  1. Ответственных стажеров, заинтересованных в освоении перспективной профессии Программист 1С 2. Тех, кто дружит с логикой, умеет выстраивать алгоритм, умеет следовать стандартам. Техническое или математическое образование - не обязательно. На одной стажировке лидером стал выпускник исторического факультета. 3. Стажеров, имеющих возможность присутствовать на обучении очно по 2-3 часа в день 2 раза в неделю в течение 1,5 месяца, готовых выделить время для выполнения домашних заданий. Мы предлагаем: 1. за 3 месяца освоить профессию Программист 1С, 2. в перспективе получить работу в молодом коллективе и уютном офисе (хвастаться не будем - придете на стажировку - все увидите сами) Самое главное что ты должен знать о нас: - мы любим наших сотрудников и заботимся о них - бесплатное обучение и сертификация, бесплатные обеды и завтраки, корпоративы, вечеринки, митапы ..... - все для интересной и уютной жизни. Кстати в нашем офисе можно ходить в тапках... или на шпильках.... короче - кому как больше нравится. - зп нашего сотрудника зависит от объема полезности, который он производит, а не от возраста и стажа работы в 1С. У нас хорошие оклады, но всегда есть возможность заработать больше; - наши программисты - молодые, веселые и спокойные люди. Они не работают в выходные и по вечерам (нет.... ну если очень хочется...... то можно - только тогда обязательно размяться в настольный теннис и съесть завтрак или поздник) . - мы с удовольствием берем на работу девочек и не считаем их вторым сортом, а считаем их классными! - наша компания существует более 15 лет. 8 лет назад мы стали Дочкой Фирмы 1С благодаря собственным продуктам, разработанными нашими ребятами. У нас - интересные задачи, адекватные руководители и удовольствие от работы. - мы не ходим по клиентам, работаем только удаленно по России и СНГ, с пользователями взаимодействует специальное подразделение Стажировка проходит в 2 этапа: 1 этап: 21.10.19 - 11.11.19 Очные занятия по 2-3 часа в день, 2 раза в неделю (всего 5 лекций) плюс домашние задания. После первого этапа - отбор по итогам выполнения заданий. Мы думаем о видеозаписях - возможно на этой стажировке попробуем стримы для удаленных стажеров. 2 этап: 13.11.19 - 15.12.19 Очно-заочный этап. Выполнение индивидуальных и совместных практикумов и более сложных, самостоятельных заданий. Встречи 2 раза в неделю (возможен индивидуальный режим). Как попасть на стажировку: 1. Откликнутся своим резюме на эту вакансию 2. Пройти собеседование и тестирование у нас в офисе. Всех успешно закончивших стажировку - мы берем на работу. Остались вопросы - звони, пиши, спрашивай. Контакты ниже. P.S. Дорогие мои и любимые кандидаты. Пожалуйста. Очень прошу. Нажимайте кнопочку откликнуться у этой вакансии.... во-первых, так проще и быстрее вам лично. Резюме дойдет - клянусь! во-вторых, когда вы мне шлете на почту ссылки (даже с этого сайта) и разные файлы - ваши чудесные резюме у меня не встают в базу. И в этом случае риск их потерять или вовремя не позвонить намного выше. Большое спасибо за понимание. все добрые слова про себя можно написать в сопроводительном письме, я их всегда читаю.";" 1. за 3 месяца освоить профессию Программист 1С, 2. в перспективе получить работу в молодом коллективе и уютном офисе (хвастаться не будем - придете на стажировку - все увидите сами) Самое главное что ты должен знать о нас: - мы любим наших сотрудников и заботимся о них - бесплатное обучение и сертификация, бесплатные обеды и завтраки, корпоративы, вечеринки, митапы ..... - все для интересной и уютной жизни. Кстати в нашем офисе можно ходить в тапках... или на шпильках.... короче - кому как больше нравится. - зп нашего сотрудника зависит от объема полезности, который он производит, а не от возраста и стажа работы в 1С. У нас хорошие оклады, но всегда есть возможность заработать больше; - наши программисты - молодые, веселые и спокойные люди. Они не работают в выходные и по вечерам (нет.... ну если очень хочется...... то можно - только тогда обязательно размяться в настольный теннис и съесть завтрак или поздник) . - мы с удовольствием берем на работу девочек и не считаем их вторым сортом, а считаем их классными! - наша компания существует более 15 лет. 8 лет назад мы стали Дочкой Фирмы 1С благодаря собственным продуктам, разработанными нашими ребятами. У нас - интересные задачи, адекватные руководители и удовольствие от работы. - мы не ходим по клиентам, работаем только удаленно по России и СНГ, с пользователями взаимодействует специальное подразделение Стажировка проходит в 2 этапа: 1 этап: 21.10.19 - 11.11.19 Очные занятия по 2-3 часа в день, 2 раза в неделю (всего 5 лекций) плюс домашние задания. После первого этапа - отбор по итогам выполнения заданий. Мы думаем о видеозаписях - возможно на этой стажировке попробуем стримы для удаленных стажеров. 2 этап: 13.11.19 - 15.12.19 Очно-заочный этап. Выполнение индивидуальных и совместных практикумов и более сложных, самостоятельных заданий. Встречи 2 раза в неделю (возможен индивидуальный режим). Как попасть на стажировку: 1. Откликнутся своим резюме на эту вакансию 2. Пройти собеседование и тестирование у нас в офисе. Всех успешно закончивших стажировку - мы берем на работу. Остались вопросы - звони, пиши, спрашивай. Контакты ниже. P.S. Дорогие мои и любимые кандидаты. Пожалуйста. Очень прошу. Нажимайте кнопочку откликнуться у этой вакансии.... во-первых, так проще и быстрее вам лично. Резюме дойдет - клянусь! во-вторых, когда вы мне шлете на почту ссылки (даже с этого сайта) и разные файлы - ваши чудесные резюме у меня не встают в базу. И в этом случае риск их потерять или вовремя не позвонить намного выше. Большое спасибо за понимание. все добрые слова про себя можно написать в сопроводительном письме, я их всегда читаю.";"1. Ответственных стажеров, заинтересованных в освоении перспективной профессии &quot;<highlighttext>Программист</highlighttext> 1С&quot;. 2. Тех, кто дружит с логикой, умеет выстраивать алгоритм...";Мы - Компания 1С ИжТиСи, дочернее предприятие фирмы 1С. Сопровождаем, обновляем и оптимизируем нетиповые конфигурации 1С. - ;
18;Программист Python;Ижевск;;;Ижевский нефтяной научный центр;2019-10-04T21:51:02+0300;1;3;Полный день;Полная занятость;"Обязанности:  Участие в полном цикле разработки продукта; Проектирование и разработка сервисов связи с внешними системами; Unit-тестирование и code-ревью.  Требования: - Высшее профессиональное (ИТ) образование - Опыт коммерческой разработки на Python от 2-х лет; - Хорошие знания принципов ООП и основных шаблонов проектирования; - Опыт работы с MySQL и/или PostgreSQL; - Опыт работы с Linux; - Знания JavaScript и знакомство с современными JS фреймворками; - Исполнительность, целеустремленность, ответственность за результат, внимание к деталям Условия:  Достойная заработная плата (по результатам собеседования) Ежемесячная премия по итогам работы Годовой бонус по итогам работы Социальный пакет (ДМС, страхование от несчастных случаев, сан-курортное оздоровление, детские путевки) ";  Достойная заработная плата (по результатам собеседования) Ежемесячная премия по итогам работы Годовой бонус по итогам работы Социальный пакет (ДМС, страхование от несчастных случаев, сан-курортное оздоровление, детские путевки) ;Высшее профессиональное (ИТ) образование. - Опыт коммерческой разработки на Python от 2-х лет. - Хорошие знания принципов ООП и основных шаблонов...;Участие в полном цикле разработки продукта. Проектирование и разработка сервисов связи с внешними системами. Unit-тестирование и code-ревью.;
19;Инженер-программист С++/QNX;Ижевск;;;Прософт-Системы;2019-10-01T08:20:17+0300;3;6;Полный день;Полная занятость;"Инженерная компания Прософт-Системы набирает команду опытных Разработчиков С++ в офис разработки в Екатеринбург. Мы ищем специалистов, которые примeт участие в разработке ПО ПЛК REGUL и ПТК AlfaREGUL. ПЛК REGUL – наша флагманская линейка контроллеров для автоматизации технологических процессов. Программно-технический комплекс AlfaRegul – симбиоз высокого уровня визуализации и управления. Основные задачи:  Разработка нового и переработка существующего ПО для промышленных контроллеров; Сопровождение разработанного ПО.  Пожелания к кандидату:  Готовность к переезду в Екатеринбург; Опыт разработка кроссплатформенных приложений на С++ под QNX; Разработка эффективных многопоточных приложений; Умение создавать надежный, тестируемый, хорошо документированный исходный код; Знание и желание следовать принципам TDD; Опыт работы в командных проектах; Быстрая обучаемость; Опыт разработки и отладки драйверов устройств, разработки Embedded ПО, знание .Net будет плюсом.  Мы предлагаем:  Заработная плата: оклад + квартальные премии, стартовые условия обсуждаются в зависимости от квалификации, опыта работы; Компенсация аренды жилья; Трудовые отношения в полном соответствии с ТК РФ; ДМС, компенсация спортивного абонемента. ";"  Заработная плата: оклад + квартальные премии, стартовые условия обсуждаются в зависимости от квалификации, опыта работы; Компенсация аренды жилья; Трудовые отношения в полном соответствии с ТК РФ; ДМС, компенсация спортивного абонемента. ";Готовность к переезду в Екатеринбург. Опыт разработка кроссплатформенных приложений на С++ под QNX. Разработка эффективных многопоточных приложений. Умение создавать надежный...;Разработка нового и переработка существующего ПО для промышленных контроллеров. Сопровождение разработанного ПО.;"C/C++; QNX; Linux"
25;Инженер-программист;Ижевск;;;ИЭМЗ КУПОЛ;2019-09-17T16:04:56+0300;1;3;Полный день;Полная занятость;Обязанности:  Программирование микроконтроллеров (МП) Организация интерфейсов работы МП-ЭВМ, прибор(ССИ)-ЭВМ Разработка программ тестирования объектов контроля Работа в LabView  Требования:  Высшее техническое образование (профильное) Опыт работы  Условия:  Полный рабочий день Соцпакет ;  Полный рабочий день Соцпакет ;Высшее техническое образование (профильное). Опыт работы.;Программирование микроконтроллеров (МП). Организация интерфейсов работы МП-ЭВМ, прибор(ССИ)-ЭВМ. Разработка программ тестирования объектов контроля. Работа в LabView.;
29;Инженер - программист отдела сопровождения автоматизированной банковской системы;Ижевск;;;Ижкомбанк, АКБ;2019-10-11T16:19:12+0300;1;3;Полный день;Полная занятость;"Обязанности   разработка функционала автоматизированной банковской системы (Oracle Forms, PL/SQL);   сопровождение модулей автоматизированной банковской системы (внедрение, консультации пользователей).   Требования   высшее техническое образование, возможно незаконченное;   знание SQL, желательно PL\SQL;   стрессоустойчивость, коммуникабельность, желание работать и повышать свою квалификацию, ответственность.   Условия  стабильная, официальная заработная плата; оформление в соответствии с ТК РФ; корпоративные мероприятия; обучение; офис в центре города; полис ДМС;  уровень должности и заработной платы - в зависимости от профессионализма.    ";;Высшее техническое образование, возможно незаконченное. Знание SQL, желательно PL\SQL. Стрессоустойчивость, коммуникабельность, желание работать и повышать свою квалификацию, ответственность.;Разработка функционала автоматизированной банковской системы (Oracle Forms, PL/SQL). Сопровождение модулей автоматизированной банковской системы (внедрение, консультации пользователей).;
31;Web-разработчик React;Ижевск;;;Крит;2019-10-11T22:35:11+0300;1;3;Гибкий график;Полная занятость;"Функции:  Разработка и сопровождение web-приложений, React  Требования:  Знание классических алгоритмов и структур данных; Опыт работы с JavaScript от 1 года; Опыт работы с React+Redux от 1 года.  Преимуществом будет:  Опыт работы с TypeScript; Опыт работы с Linux системами; Знание других языков программирования, например C/C++, Python; Опыт работы с СУБД, например MySQL, PostgreSQL. ";;Знание классических алгоритмов и структур данных. Опыт работы с JavaScript от 1 года. Опыт работы с React+Redux от 1 года. ;Функции: Разработка и сопровождение web-приложений, React.;"Python; MySQL; PostgreSQL; JavaScript; Linux; React"
33;Инженер-программист отдела сопровождения банковских карт;Ижевск;;;Ижкомбанк, АКБ;2019-10-11T16:19:14+0300;1;3;Полный день;Полная занятость;"Обязанности   разработка программного обеспечения для взаимодействия с внешними системами (C++, Oracle PL/SQL).   Требования   Высшее техническое образование (фак-т ИВТ), возможно незаконченное;   Умение читать и понимать техническую документацию на англ.языке;   Умение программировать хотя бы на одном языке программирования обязательно;   Стрессоустойчивость, коммуникабельность, желание работать и повышать свою квалификацию, ответственность;   Желательно знание C++ и PL/SQL или желание их изучить.   Условия  стабильная, официальная заработная плата; оформление в соответствии с ТК РФ; корпоративные мероприятия; обучение; офис в центре города; полис ДМС;  уровень должности и заработной платы - в зависимости от профессионализма.  ";;Высшее техническое образование (фак-т ИВТ), возможно незаконченное. Умение читать и понимать техническую документацию на англ.языке. Умение программировать хотя бы...;Разработка программного обеспечения для взаимодействия с внешними системами (C++, Oracle PL/SQL).;
