;name;city;min_salary;max_salary;company;published_at;min_experience;max_experience;schedule;employment;description;conditions;requirement;responsibility;key_skills
89;Программист 1С;Тюмень;80460.0;;Нэти;2019-10-02T11:16:55+0300;1;3;Полный день;Полная занятость;Наша компания занимается профессиональной разработкой 1С на крупных проектах заказчиков на территории России и за рубежом. Среди наших постоянных клиентов:ВТБ Капитал, Хлебпром, Быстроденьги, Расстал, Керама Марацци, Келли Сервисез, ВСК, Кораблик, Центральный телеграф, Свеза, Май, Седрус, а также компании из Германии, Голландии, Испании, Швеции, Израиля. Открытие вакансии связано с расширением направления 1С. Кратко о параметрах работы:  Зарплата у разработчика фиксированная и не зависит от возможных простоев или оплаты от клиентов. Командировок и разъездов нет. Работа по нормальному графику (8 часов/день). Работаем только в роли разработчиков, никакого общения с конечными пользователями. Всегда есть отдельный консультант 1С, который ставит задачи. У нас очень хороший обмен опытом в коллективе. В первую неделю вас подтянут по знаниям, в которых у вас есть пробелы. Текучести кадров нет. Стабильность и расширение есть.  Что важно уметь кандидату в области программирования:  Иметь практический продуктивный опыт разработки на 1С 8.х от 2,5 лет и выше. Хорошие знания типовых объектов метаданных, СКД и управляемых форм. Умение писать понятный другим людям код без грубых ошибок оптимизации. Знать, как правильно дорабатывать конфигурацию, чтобы было минимум проблем с обновлением. Желательно знать на техническом уровне одну или более конфигурации (то есть иметь опыт серьезного анализа и изменения кода основных типовых механизмов в них).  Если у вы чувствуете, что уровень знаний ниже, но вы горите желанием его подтянуть, то откликайтесь и пообщаемся. Что будет делать сотрудник:  Разработка на платформе 1С 8.x по тех. заданию и без (онлайн-общение с консультантом по скайпу). Уточнение заданий у консультанта. Предоставление оперативной информации консультанту и руководителю проекта о статусах своих задач, возможных сроках, видимых рисках, а также трудностях, в которых они могут помочь.  Что предоставим мы:  Оформление по ТК РФ. Работа официально, в штате. Весь оклад фиксированный, от 80 460 руб. до вычета НДФЛ (не зависит от простоев или оплаты клиентов). За все время существования компании не было ни одной задержки выплаты зарплаты. Работа из подходящего вам места (города/страны).(Основной офис в Казани, отсюда тоже можно работать). После года работы мы подключим вас к системе добровольного медицинского страхования. Активно развиваем внутреннее обучение. У вас будет возможность как учиться у коллег, так и обучать их. Накопление знаний у нас в области разработки в среднем идет в 5 раз быстрее, чем у конечного клиента и в 2 раза быстрее чем во франче. Нас привлекают, потому что мы спецы в своем деле и идем в ногу со временем в новейших технологиях. Есть возможность сдвинуть свой график на удобное для вас время (стандарт с 9 до 18 по московскому времени, возможен сдвиг +/- 1 час). Для тех, кто влюблен в деньги, есть возможность перерабатывать (необязательно, но если очень хочется, то можно). У нас вы не останетесь узким специалистом, постоянная работа с разными конфигурациями вам обеспечена (опыт планомерно растекается по коллективу). У нас постоянная активность во всех областях развития компании. Если захотите, то вы сможете проявить себя не только в должности разработчика 1С, но и в любой другой роли. Хорошо работает взаимопомощь. Можно задать вопрос в общем корпоративном чате по 1С. Там сейчас 85+ сотрудников, готовых помочь. Оплата больничных, отпусков и всего, что предусмотрено ТК РФ. Помимо оклада вы получите полугодовой бонус. Большая и постоянно пополняющаяся база курсов по 1С. Плюс есть возможность приобрести за счет компании любые индивидуальные курсы по 1С.  Также у нас есть и другие направления. Microsoft Axapta, PHP, Bitrix, Machine Learning. Если вам в будущем захочется сменить направление, то мы сможем это организовать. Есть накопленные в базе знаний материалы, наставники и желание растить людей.;;Иметь практический продуктивный опыт разработки на 1С 8.х от 2,5 лет и выше. Хорошие знания типовых объектов...;Разработка на платформе 1С 8.x по тех. заданию и без (онлайн-общение с консультантом по скайпу). ;
57;Ведущий программист 1С;Ижевск;85000.0;;МИЛКОМ;2019-10-09T15:21:50+0300;1;3;Полный день;Полная занятость;В ОАО «МИЛКОМ», в связи С РАСШИРЕНИЕМ ШТАТА, требуется программист 1С.МИЛКОМ - это стабильно развивающееся предприятие (6 площадок в Удмуртии, Пермском крае, Татарстане), занимающее 4-ое место среди переработчиков молока в РФ. Наша цель - стать национальной компанией №1. Производственные площадки оборудованы современными линиями по глубокой переработке сырья и ежегодно наращивают объемы производства.Мы ищем энергичных, активных, инициативных и позитивно настроенных кандидатов. Главные требования:• опыт программирования в системе 1С 8.х от 2-х лет• хорошее «качество» и высокая скорость написания кода•  приветствуется наличие сертификатов 1С и базовых знаний бухгалтерского учета, производственного учета, планирования• приветствуется опыт конфигурирования и участие в проектах внедрения конфигурации 1С ERP 2.х В зону ответственности будет входить:•  устранение проблем в работе информационных систем на базе 1С• реализация изменений в информационных системах 1С по согласованным техническим заданиям• поддержка пользователей• участие в рабочих совещаниях и рабочих группах компании по системам автоматизации 1С и связанных с ними бизнес-процессов Что готовы предложить Вам:• работа в крупном агропромышленном холдинге• официальное трудоустройство, согласно ТК РФ• официальная заработная плата два раза в месяц• график работы: 5/2 (понедельник-пятница) с 8.30 до 17.20• компенсация сотовой связи• полис ДМС• льготные цены в столовой• служебный автобус по городу• ежегодная индексация ЗП• посещение тематических конференций (инфостарт и т.п.) за счёт работодателя• обучение и сертификация за счёт компании• премии по факту закрытия крупных проектов по автоматизации Мы благодарим каждого соискателя на данную должность, который направит нам свое резюме! Ваше резюме будет рассмотрено в кратчайшие сроки.На собеседования будут приглашены кандидаты, максимально соответствующие заявленным в вакансии требованиям к профессиональному опыту и знаниям.;;Опыт программирования в системе 1С 8.х от 2-х лет. Хорошее «качество» и высокая скорость написания кода. ;Устранение проблем в работе информационных систем на базе 1С. Реализация изменений в информационных системах 1С по согласованным техническим...;"ERP; 1С программирование; 1С: Предприятие 8; SQL; MS SQL"
60;Ведущий разработчик 1С;Тюмень;90000.0;;Золотые луга;2019-10-07T06:36:19+0300;3;6;Полный день;Полная занятость;"Должностные обязанности:  Построение и поддержание оптимальной структуры учётных систем в компании. Анализ технических заданий пользователей на предмет целесообразности и влияния на существующие бизнес-процессы, проверка различных вариантов решения задач. Координация работы программистов: постановка задач на автоматизацию, контроль сроков и качества исполнения. Обучение и помощь пользователям при работе в учётных системах. Взаимодействие с разработчиком BI-аналитики    Требования:  Опыт работы в крупной производственной компании Опыт работы Руководителем IT проектов, 1С проектов Опыт разработки решений на платформе 1С 8.2/8.3 Знание языка запросов и СКД (система компоновки данных) Знание конфигураций 1С:УПП, 1С:ERP Знание прикладных областей (производство, торговая деятельность, складской учет, логистика) Опыт самостоятельного ведения проектов, успешных внедрений продуктов на базе платформы 1С Опыт руководства и работы в команде разработчиков Опыт сбора и формализации требований, составления технических заданий,постановки задач программистам Навыки оценки задач на автоматизацию на предмет влияния на существующие бизнес-процессы Настройка и публикация веб-сервисов, использование OData Понимание принципов реализации различных API    Условия:  Официальное трудоустройство согласно ТК РФ; Социальный пакет согласно ТК РФ; Своевременная и официальная заработная плата Перспективы профессионального и карьерного роста в компании Золотые Луга.     ";"  Официальное трудоустройство согласно ТК РФ; Социальный пакет согласно ТК РФ; Своевременная и официальная заработная плата Перспективы профессионального и карьерного роста в компании Золотые Луга.     ";Опыт руководства и работы в команде <highlighttext>разработчиков</highlighttext>. Опыт сбора и формализации требований, составления технических заданий,постановки задач <highlighttext>программистам</highlighttext>. ;Координация работы <highlighttext>программистов</highlighttext>: постановка задач на автоматизацию, контроль сроков и качества исполнения. Обучение и помощь пользователям при работе в учётных...;
12;Java-программист;Тюмень;100000.0;;Стабильный Программный Код;2019-09-27T11:04:34+0300;3;6;Полный день;Полная занятость;Обязанности:  Доработка и сопровождение серверной части системы приема платежей от населения Разработка и сопровождение серверной части мобильного кошелька  Требования:  Знание основных фреймворков SpringFramework, Hibernate, SpringBoot, Vaadin Принципы сетевого взаимодействия, сетевые протоколы HTTP/HTTPS, XMPP, AMQP Основы микросервисов, виртуализация на базе Docker (docker-compose) CI/CD на базе GitLab Английский письменный (обязательно !!!)  Условия:  Полный рабочий день Белая зарплата Работа в офисе в центре города Небольшой коллектив ;  Полный рабочий день Белая зарплата Работа в офисе в центре города Небольшой коллектив ;Знание основных фреймворков SpringFramework, Hibernate, SpringBoot, Vaadin. Принципы сетевого взаимодействия, сетевые протоколы HTTP/HTTPS, XMPP, AMQP. Основы микросервисов, виртуализация на...;Доработка и сопровождение серверной части системы приема платежей от населения. Разработка и сопровождение серверной части мобильного кошелька.;
14;Android разработчик (Middle);Ижевск;100000.0;;CG Tribe;2019-10-10T00:09:00+0300;1;3;Полный день;Полная занятость;"В команду CGTribe ищем разработчика Androind приложений.Обязанности:  разработка и поддержка мобильного приложения под Android; разработка основных алгоритмов и архитектуры приложения; поддержка приложения после его выпуска; последующая доработка и внедрение новых функций.  Требования:  уверенное знание Java и ООП; опыт разработки мобильных приложений Android; опыт создания клиент-серверных приложений; общее понимание паттернов проектирования; английский язык на уровне понимания технической литературы.  Условия:  достойная твоего профессионального уровня зарплата, размер обсуждается на собеседовании; график работы 5/2; компенсация занятий спортом; молодой дружный коллектив, корпоративные мероприятия; чай, кофе, печеньки. ";"  достойная твоего профессионального уровня зарплата, размер обсуждается на собеседовании; график работы 5/2; компенсация занятий спортом; молодой дружный коллектив, корпоративные мероприятия; чай, кофе, печеньки. ";Уверенное знание Java и ООП. Опыт разработки мобильных приложений Android. Опыт создания клиент-серверных приложений. Общее понимание паттернов проектирования. ;Разработка и поддержка мобильного приложения под Android. Разработка основных алгоритмов и архитектуры приложения. Поддержка приложения после его выпуска. ;"Java; Android"
46;Программист 1С 8 Айлант Управление ЖКХ;Ижевск;100000.0;;РИЦ ЖРП 8;2019-10-10T16:09:19+0300;0;0;Полный день;Полная занятость;Обязанности: доработка конфигурации «Айлант:Управление ЖКХ»Добавление информационной базыНастройка системы защитыАктивацияПорядок обновления конфигурацииСправочники коммунального учетаформирование отчетов Требования: Мы ищем человека, который: Знает платформу 1С:Предприятие на уровне 1С ЭкспертаИмеет опыт в анализе и устранении неполадок крупномасштабных системУмеет отлаживать и оптимизировать код, ускорять запросыСможет работать в роли эксперта по технологическим вопросам (анализ загруженности оборудования, выявление проблем производительности, выработка решений по оптимизации) Условия: Официальное трудоустройство по ТК РФ, соц.пакетГрафик работы 5/2 с 8:00 до 17:00. Возможна корректировка времени начала и окончания рабочего дняРезюме ждем на адрес  ; Официальное трудоустройство по ТК РФ, соц.пакетГрафик работы 5/2 с 8:00 до 17:00. Возможна корректировка времени начала и окончания рабочего дняРезюме ждем на адрес  ;Порядок обновления конфигурации. Имеет опыт в анализе и устранении неполадок крупномасштабных систем. Умеет отлаживать и оптимизировать код, ускорять запросы.;Доработка конфигурации «Айлант:Управление ЖКХ». Добавление информационной базы. Настройка системы защиты. Активация. Справочники коммунального учета. Формирование отчетов. Сможет работать в...;"1С: Предприятие 8; 1C: Бухгалтерия; 1С программирование; MS Access"
