;name;city;min_salary;max_salary;company;published_at;min_experience;max_experience;schedule;employment;description;conditions;requirement;responsibility;key_skills
23;Программист-разработчик;Ижевск;50000.0;60000.0;Фирма Стандарт-н;2019-09-13T08:03:51+0300;1;3;Полный день;Полная занятость;Обязанности:  Требуется программист - разработчик. Разработка и поддержка прикладных программ, среда разработки - Delphi  Требования:   - Высшее техническое образование, - Знание языков программирования - Аккуратность, коммуникабельность, умение достигать своей цели.   Условия:   Начальная з/п по итогам собеседования Перспективы роста Полный рабочий день На территории работодателя  ;   Начальная з/п по итогам собеседования Перспективы роста Полный рабочий день На территории работодателя  ;Высшее техническое образование. - Знание языков программирования. - Аккуратность, коммуникабельность, умение достигать своей цели.;;
51;Ведущий инженер-программист (сопровождение 1С:8.x);Тюмень;60000.0;60000.0;Запсибгазпром-Газификация;2019-10-08T07:29:43+0300;6;0;Полный день;Полная занятость;Обязанности: - выявление, сбор, анализ, уточнение и формирование потребностей сопровождаемых клиентов при работе с корпоративной системой на базе 1С различных конфигураций- сопровождение клиентов в системе, консультации по вопросам работы программы. Выезд в офис клиента (при личной договоренности)- самостоятельные мелкие изменения в системе, доработки. Инсталляция в системе произведенных изменений- постановка задач (формирование ТЗ) программисту на значительные доработки в 1С- обучение сотрудников клиента. Составление рабочих инструкций для пользователей.- отчет по выполненной работе.- взаимодействие с бизнес-консультантами по развитию системы Профессиональные навыки: - развитые коммуникативные навыки- владение техниками работы с возражениями- профессиональное знание 1С:УПП (Управление продажами, Управление закупом, Управление производством, Управление запасами - на уровне продвинутого пользователя)- приветствуется знание 1С:Бухгалтерия, Зарплата и управление персоналом, Управление торговлей Требования:   опыт работы от 5 лет высшее профессиональное образование - специальное, по профилю дополнительное образование  Условия:  официальное трудоустройство, официальная заработная плата отпуск, больничный лист, согласно ТК РФ безлимитный полис ДМС  Приглашаем на работу в крупную строительную организацию. Просим направлять резюме на указанную почту в данной вакансии.;  официальное трудоустройство, официальная заработная плата отпуск, больничный лист, согласно ТК РФ безлимитный полис ДМС  Приглашаем на работу в крупную строительную организацию. Просим направлять резюме на указанную почту в данной вакансии.;Профессиональные навыки: - развитые коммуникативные навыки. - владение техниками работы с возражениями. - профессиональное знание 1С:УПП (Управление продажами, Управление закупом, Управление...;Инсталляция в системе произведенных изменений. - постановка задач (формирование ТЗ) <highlighttext>программисту</highlighttext> на значительные доработки в 1С. - обучение сотрудников клиента. ;
5;Laravel-разработчик;Ижевск;;60000.0;WM Studio;2019-10-12T09:02:47+0300;1;3;Удаленная работа;Полная занятость;Требования:  Уверенное знание PHP, LARAVEL, MySQL. Опыт работы с фреймворком laravel. Наличие завершенных проектов.  Чем предстоит заниматься:  ​Разработка и поддержка проектов на laravel.  Условия:  Удалённая работа. Молодой и дружный коллектив. Много интересных задач, никакого конвейера. Работа с крупными российскими и иностранными проектами. Официальное оформление после испытательного срока (по желанию). Корпоративные мероприятия. Возможен плавающий график начала и окончания рабочего дня.  Собеседование будет проводиться в Skype, а также включать в себя тестовое задание и решение задач на знание php и laravel.;  Удалённая работа. Молодой и дружный коллектив. Много интересных задач, никакого конвейера. Работа с крупными российскими и иностранными проектами. Официальное оформление после испытательного срока (по желанию). Корпоративные мероприятия. Возможен плавающий график начала и окончания рабочего дня.  Собеседование будет проводиться в Skype, а также включать в себя тестовое задание и решение задач на знание php и laravel.;Уверенное знание PHP, LARAVEL, MySQL. Опыт работы с фреймворком laravel. Наличие завершенных проектов.;Разработка и поддержка проектов на laravel.;"JavaScript; Ajax; PHP; laravel; MySQL; SQL; jQuery; Redis"
33;Программист;Тюмень;40000.0;55000.0;ГАУ ТО ЦЗН города Тюмени и Тюменского района;2019-10-11T06:55:39+0300;0;0;Полный день;Полная занятость;"Обязанности:   Ваша работа будет заключаться в ... - Консультации пользователей по вопросам работы в программных продуктах 1С (УПП, Бухгалтерия, ЗУП); - Программировании и доработке конфигураций 1С в соответствии с техническими заданиями; - Мониторинге выхода новых типовых конфигураций необходимых для обновления программ на базе 1С, контроль изменений в новых конфигурациях; - Разработке конфигурации в 1С по представленным техническим заданиям других отделов и подразделений предприятия.  Требования:   нет требований к стажу Работа с компьютером на профессиональном уровне Эта работа для Вас если… - Вы имеете высшее техническое образование; - Умеете проектировать информационные системы и базы данных, владеть встроенным языком программирования 1С, имеете опыт программирования в иных формализованных языках программирования; - Ориентируетесь в основных конфигурациях 1С связанных с функционированием средних и крупных предприятий; - Знаете устройство и принципы работы операционных систем и компьютерной техники; - Умеете работать в режиме многозадачности.   Условия:   Пятидневная рабочая неделя с 8-00 до 17-00   оформление в рамках трудового законодательства   Повременно-премиальная оплата труда  Адрес рабочего места: рп Винзили, р-н Тюменский, ул Вокзальная развозка людей питание в столовой обучение за счет работодателя вакансия рассматривается по результатам изучения резюме ";   Пятидневная рабочая неделя с 8-00 до 17-00   оформление в рамках трудового законодательства   Повременно-премиальная оплата труда  Адрес рабочего места: рп Винзили, р-н Тюменский, ул Вокзальная развозка людей питание в столовой обучение за счет работодателя вакансия рассматривается по результатам изучения резюме ;Нет требований к стажу. Работа с компьютером на профессиональном уровне. Эта работа для Вас если…. - Вы имеете высшее техническое образование. - ;Ваша работа будет заключаться в ... - Консультации пользователей по вопросам работы в программных продуктах 1С (УПП, Бухгалтерия, ЗУП). - ;
9;Frontend-разработчик;Тюмень;30000.0;50000.0;АЙТИ АРХИТЕКТОР;2019-10-11T18:03:43+0300;1;3;Полный день;Полная занятость;"Обязанности:  Верстка сайтов, landing page, интернет магазинов, взаимодействие по макету с дизайнером; Верстка интерфейсов, модулей внутренних систем; Разработка / модернизация JS / VUE / JQuery скриптов; Оптимизация верстки.  Требования:  Отличное знание HTML5 / CSS3; Уверенное знание JS / JQuery / VUE; Знание одного из UI фреймворков: Vuetify, ElementIO, IView; Кроссбраузерная и адаптивная мобильная верстка; Опыт работы с Git; Четкое понимание юзабилити интерфейса; Умение разбираться в чужом коде; Умение выполнять задачу в заданный срок; Ответственность, умение работать самостоятельно и относиться к задаче внимательно; Знание основ ООП; Знание основ PHP; Понимание как работает бэкенд.  Условия:  Пятидневная рабочая неделя с 08:30 до 17:30 Официальное трудоустройство Центр, район дома Печати Молодой, активный коллектив Возможность совершенствовать навыки и развиваться Отличный офис в тихом месте, нет проблем с парковкой, кафе на территории, чай-кофе-печеньки в офисе Кандидатуры freelance не рассматриваем! Вместе с резюме отправьте ссылки на выполненные вами работы для оценки верстки и клиентского кода ";  Пятидневная рабочая неделя с 08:30 до 17:30 Официальное трудоустройство Центр, район дома Печати Молодой, активный коллектив Возможность совершенствовать навыки и развиваться Отличный офис в тихом месте, нет проблем с парковкой, кафе на территории, чай-кофе-печеньки в офисе Кандидатуры freelance не рассматриваем! Вместе с резюме отправьте ссылки на выполненные вами работы для оценки верстки и клиентского кода ;Отличное знание HTML5 / CSS3. Уверенное знание JS / JQuery / VUE. Знание одного из UI фреймворков: Vuetify, ElementIO, IView. ;Верстка сайтов, landing page, интернет магазинов, взаимодействие по макету с дизайнером. Верстка интерфейсов, модулей внутренних систем. Разработка / модернизация JS / VUE...;"Веб-программирование; HTML5; jQuery; CSS3; Ajax; Git; JavaScript; Кроссбраузерная верстка; Валидная верстка; Sass; JSON API; VUE"
10;Веб-программист / Web-разработчик;Тюмень;30000.0;50000.0;Интерактивное агентство Aerokod;2019-10-04T19:09:54+0300;1;3;Гибкий график;Полная занятость;Обязанности:  Разработка и поддержка web-проектов. Доработка существующих сайтов и разработка новых. Программирование и тестирование сайтов.  Требования:  Глубокие знания PHP, MySQL. Уверенные знания HTML5, CSS3, JavaScript, JQuery. Понимание принципов ООП. Опыт работы с API внешних сервисов. Умение разбираться в чужом коде. Умение писать простой и понятный код, следуя принятой методологии. Системное видение проектов и логическое мышление. Самостоятельность и самоорганизованность. Неважно, что вы знаете фреймворки Code Ignieter, Simfony 2, Yii 2, CMS Битрикс (Bitrix), Wordpress, мы постараемся оценить вас по достоинству.  Условия:  Команда, увлеченная проектами. Постоянные вызовы твоему профессионализму. У тебя будет масса возможностей проявить себя и множество точек роста. Адекватное руководство. Гибкий график по согласованию. Отличное рабочее место, круглосуточный доступ, уютный офис, натуральный кофе, чай. ;  Команда, увлеченная проектами. Постоянные вызовы твоему профессионализму. У тебя будет масса возможностей проявить себя и множество точек роста. Адекватное руководство. Гибкий график по согласованию. Отличное рабочее место, круглосуточный доступ, уютный офис, натуральный кофе, чай. ;Глубокие знания PHP, MySQL. Уверенные знания HTML5, CSS3, JavaScript, JQuery. Понимание принципов ООП. Опыт работы с API внешних...;Разработка и поддержка web-проектов. Доработка существующих сайтов и разработка новых. Программирование и тестирование сайтов.;"Веб-программирование; HTML; JavaScript; CSS; MySQL; PHP5; jQuery; PHP; HTML5; 1С-Битрикс; Bootstrap; Ajax; Yii; ООП; CSS3; CMS Wordpress; Кроссбраузерная верстка"
32;Программист в отдел тестирования;Тюмень;30000.0;50000.0;Сервис заказа такси Максим;2019-10-11T14:20:37+0300;1;3;Полный день;Полная занятость;"Максим ищет программиста в отдел тестирования в Екатеринбурге, Челябинске, Тюмени, Кургане и Набережных Челнах. Кто мы:- IT-компания, предоставляющая облачное решение в сфере такси.К проекту подключено большое количество компаний, среди которых как мелкие региональные игроки, так и компании с мировым именем, с сотнями городов и десятками стран присутствия. Что у нас есть:Активно меняющийся и развивающийся сервис, находящийся 24/7 под высокой нагрузкой от тысяч операторов и менеджеров, от десятков тысяч клиентов и водителей. Сервис, обслуживающий более миллиона заказов в сутки! Кого мы хотим найти:- человека владеющего одним из современных языков программирования C#, Java, php, Go;- очень желателен опыт работы с sql, Soap, git;- с пониманием что тесты нужны и того какие виды тестирования бывают;- обязательно: быть ответственным, трудолюбивым, писать понятный код и иметь огромное желание развиваться. Что мы предлагаем:- множество интересных задач;- дружелюбный коллектив;- корпоративное обучение;- поездки на it-конференции;- комфортное рабочее место;- компенсацию питания;- бесплатные корпоративные мероприятия (Новый Год, командные выезды и движухи);- уровень заработной платы, который зависит от технических знаний и навыков (+ регулярный пересмотр, если вы растете).";;очень желателен опыт работы с sql, Soap, git. - с пониманием что тесты нужны и того какие виды тестирования бывают. - ;;
35;Программист 1C;Ижевск;30000.0;50000.0;СПЛИТ;2019-10-11T08:34:47+0300;0;0;Полный день;Полная занятость;Приглашаем на работу программиста 1 с Задачи: 1. Написание отчетов в 1с 7 и 8 2. Поддержка действующих программ и их доработка Условия: 1. официальное трудоустройство, соц. пакет 2. график работы 5\2 с 8-30 до 17-00 3. территориально: ленинский район, есть служебный автобус 4. заработная плата от 30000 до 50000 руб. Требования: 1. Знание 1с 7, 8.1,8.3 2. Знание конфигураций УТ, КАМИН, Бухгалтерия приветствуется    ; 1. официальное трудоустройство, соц. пакет 2. график работы 5\2 с 8-30 до 17-00 3. территориально: ленинский район, есть служебный автобус 4. заработная плата от 30000 до 50000 руб. Требования: 1. Знание 1с 7, 8.1,8.3 2. Знание конфигураций УТ, КАМИН, Бухгалтерия приветствуется    ;1. Знание 1с 7, 8.1,8.3. 2. Знание конфигураций УТ, КАМИН, Бухгалтерия приветствуется.;1. Написание отчетов в 1с 7 и 8. 2. Поддержка действующих программ и их доработка.;
1;Front-end разработчик / HTML-верстальщик;Ижевск;;50000.0;Гром-Ит;2019-10-11T19:14:50+0300;1;3;Полный день;Полная занятость;Мы открываем Ижевский офис веб-разработки, в связи с чем в нашей команде открыта вакансия Frontend – разработчик/HTML-верстальщик. Мы ждем талантливого специалиста любящего работу в области верстки, нацеленного на достижение выдающихся результатов, стремящегося постоянно совершенствовать и развивать свои знания и навыки. Зона ответственности:  Верстка дизайн-макетов (все макеты в FIGMA) Оживление макетов с использование TWIG Взаимодействие с командой разработчиков (GIT) Оценка задач и участие в планировании работ  Наш кандидат:  Кроссбраузерная и адаптивная верстка на HTML5 и CSS3. Опыт разработки на JavaScript Знание FlexBox и Grid Понимание принципов БЭМ  Будет плюсом:  Опыт работы с OctoberCms Знание препроцессоров sass/scss, less  Условия:  Удобный офис в центре Ижевска Команда специалистов, готовая обучать и быть наставниками Трудоустройство по ТК РФ, конкурентоспособная белая заработная плата График работы: 5/2, с 9:00 до 18:00 либо с 10:00 до 19:00 ;  Удобный офис в центре Ижевска Команда специалистов, готовая обучать и быть наставниками Трудоустройство по ТК РФ, конкурентоспособная белая заработная плата График работы: 5/2, с 9:00 до 18:00 либо с 10:00 до 19:00 ;Кроссбраузерная и адаптивная верстка на HTML5 и CSS3. Опыт разработки на JavaScript. Знание FlexBox и Grid. ;Верстка дизайн-макетов (все макеты в FIGMA). Оживление макетов с использование TWIG. Взаимодействие с командой <highlighttext>разработчиков</highlighttext> (GIT). Оценка задач и...;"HTML5; CSS3; JavaScript; jQuery; Кроссбраузерная верстка; БЭМ"
