;id;name;city;min_salary;max_salary;company;published_at;experience;schedule;employment;description;conditions;requirement;responsibility;key_skills
93;31034157;Инженер-программист;Екатеринбург;30000.0;35000.0;Государственное бюджетное учреждение здравоохранения Медицинский информационно-аналитический центр (ГБУЗ СО МИАЦ);2019-10-07T06:58:50+0300;От 1 года до 3 лет;Полный день;Полная занятость;Обязанности:  организация внедрения информационных систем в сфере здравоохранения подготовка и согласование внутренних распорядительных документов по внедрению информационных систем (ИС) в лечебных учреждениях области сбор и документирование функциональных требований и разработка технических заданий на внедрение ИС разработка схем тестирования ИС администрирование информационных систем, методическое сопровождение разработка ведомственных информационных систем в сфере здравоохранения области  Требования:  образование высшее техническое (информационные системы и вычислительная техника) знание операционных систем  наличие навыков программирования  знание SQL и основы оптимизации запросов хороший уровень письменного русского языка умение четко формулировать свои мысли  Условия:  оформление в соответствии с Трудовым кодексом РФ 3 дня дополнительного оплачиваемого отпуска работа в современном офисе в центре города удобные транспортные развязки (район Малышева-Гагарина) дружный молодой коллектив нормированный рабочий день с графиком работы с понедельника по пятницу с 9.00 до 18.00, суббота,воскресенье – выходные дни ;  оформление в соответствии с Трудовым кодексом РФ 3 дня дополнительного оплачиваемого отпуска работа в современном офисе в центре города удобные транспортные развязки (район Малышева-Гагарина) дружный молодой коллектив нормированный рабочий день с графиком работы с понедельника по пятницу с 9.00 до 18.00, суббота,воскресенье – выходные дни ;Образование высшее техническое (информационные системы и вычислительная техника). Знание операционных систем. Наличие навыков программирования. Знание SQL и основы оптимизации запросов. ;Организация внедрения информационных систем в сфере здравоохранения. Подготовка и согласование внутренних распорядительных документов по внедрению информационных систем (ИС) в лечебных...;"навыки программирования;; знание основных операционных систем; ответственность"
18;33742963;Инженер-программист;Тюмень;20000.0;25000.0;Управление Роспотребнадзора по Тюменской области;2019-09-24T12:39:14+0300;От 1 года до 3 лет;Полный день;Полная занятость;Обязанности: 1. Устанавливает на серверы и рабочие станции операционные системы и необходимое для работы программное обеспечение.2.Осуществляет конфигурацию программного обеспечения на серверах и рабочих станциях.3.Поддерживает в работоспособном состоянии программное обеспечение серверов и рабочих станций.4.Регистрирует пользователей локальной сети и почтового сервера, назначает идентификаторы и пароли.5.Осуществляет техническую и программную поддержку пользователей, консультирует пользователей по вопросам работы локальной сети и программ, составляет инструкции по работе с программным обеспечением и доводит их до сведения пользователей.6.Устанавливает права доступа и контролирует использование сетевых ресурсов.7.Обеспечивает своевременное копирование, архивирование и резервирование данных.8.Принимает меры по восстановлению работоспособности локальной сети при сбоях или выходе из строя сетевого оборудования.9.Выявляет ошибки пользователей и программного обеспечения и принимает меры по их исправлению.10.Проводит мониторинг сети, разрабатывает предложения по развитию инфраструктуры сети.11.Обеспечивает сетевую безопасность (защиту от несанкционированного доступа к информации, просмотра или изменения системных файлов и данных), безопасность межсетевого взаимодействия.12.Осуществляет антивирусную защиту локальной вычислительной сети, серверов и рабочих станций.13.Готовит предложения по модернизации и приобретению сетевого оборудования.14.Осуществляет контроль за монтажом оборудования локальной сети специалистами сторонних организаций.15.Сообщает своему непосредственному руководителю о случаях нарушения правил пользования локальной вычислительной сетью и принятых мерах.   Требования:  профильное профессиональное образование, опыт технического обслуживания и ремонта персональных компьютеров и оргтехники.    Условия:  в соответствии с трудовым законодательством   ;  в соответствии с трудовым законодательством   ;Профильное профессиональное образование, опыт технического обслуживания и ремонта персональных компьютеров и оргтехники.;1. Устанавливает на серверы и рабочие станции операционные системы и необходимое для работы программное обеспечение. 2.Осуществляет конфигурацию программного обеспечения на...;"Администрирование сетевого оборудования; Настройка сетевых подключений; Внутренний контроль; Cистемы управления базами данных; Настройка ПК; Настройка почтовых серверов; Техническое обслуживание; Выездное обслуживание"
16;30889412;Инженер-программист;Челябинск;18500.0;18500.0;Филиал МАУ МФЦ города Челябинска;2019-10-18T11:14:23+0300;От 1 года до 3 лет;Полный день;Полная занятость;"Обязанности: -конфигурация, настройка и администрирование ПК на базе Windows, настройка периферийных устройств, оргтехники;- техническая поддержка пользователей;- администрирование средств защиты информации и средств криптографической защиты информации совместно с ведущим специалистом по защите информации;- помощь ведущему специалисту по защите информации в ведении документации. Требования: - среднее или высшее профессиональное образование (информационные технологии, информационная безопасность)- знание принципов, основ построения и обслуживания ЛВС;- знание и нормативно-методических документов в области защиты информации;- знание программных средств, используемых в целях обеспечения защиты информации (КриптоПро, Secret Net/Secret Net Studio, VipNet, антивирус Касперского);- знание порядка оформления технической документации по защите информации;Желательно:- опыт работы от 1 года;- практический опыт работы с СЗИ и СКЗИ;- опыт ведения/разработки нормативно-методической документации по защите информации. Условия: официальное трудоустройство по ТК РФ полный соц.пакет работа в центре города дружный молодой коллектив возможность карьерного роста"; официальное трудоустройство по ТК РФ полный соц.пакет работа в центре города дружный молодой коллектив возможность карьерного роста;среднее или высшее профессиональное образование (информационные технологии, информационная безопасность). - знание принципов, основ построения и обслуживания ЛВС. - знание и нормативно-методических...;конфигурация, настройка и администрирование ПК на базе Windows, настройка периферийных устройств, оргтехники. - техническая поддержка пользователей. - администрирование средств защиты информации и...;
60;34059658;Инженер-программист;Ростов-на-Дону;20000.0;;Алмаз;2019-10-14T08:48:42+0300;От 1 года до 3 лет;Полный день;Полная занятость;"Обязанности:  Разработка, тестирование и отладка программ; Запуск отлаженных программ и ввод исходных данных, определяемых условиями поставленных задач; Сопровождение внедренных программ и программных средств.  Требования:  Высшее образование; Опыт работы от 1 года; Аналитический склад ума и системное мышление; Хорошее понимание оперативного, управленческого учета; Знание бухгалтерского учета будет преимуществом; Опыт внедрения ERP систем; Знание основных методологий разработки; Владение методиками сбора и анализа требований; Знание теории бизнес-анализа (языки моделирования, методологии функционального моделирования, документирование процессов); Опыт написания технической документации; Умение быстро адаптироваться к новым условиям, находчивость, умение быстро находить решение; Коммуникабельность, неконфликтность, уравновешенность; Умение аргументировать и отстаивать свою точку зрения.  Условия:  5-дневная рабочая неделя, выходные: суббота, воскресенье; Режим работы: с 08:00 до 17:00, перерыв: с 12:00 до 13:00; Оплата труда - договорная; Имеется профсоюзная организация. ";"  5-дневная рабочая неделя, выходные: суббота, воскресенье; Режим работы: с 08:00 до 17:00, перерыв: с 12:00 до 13:00; Оплата труда - договорная; Имеется профсоюзная организация. ";Высшее образование. Опыт работы от 1 года. Аналитический склад ума и системное мышление. Хорошее понимание оперативного, управленческого учета. ;Разработка, тестирование и отладка программ. Запуск отлаженных программ и ввод исходных данных, определяемых условиями поставленных задач. Сопровождение внедренных программ и...;"Бизнес-анализ; Системное мышление; Аналитическое мышление; Деловая коммуникация"
87;34058575;Инженер-программист;Екатеринбург;25000.0;;Уральский электромеханический завод;2019-10-14T07:53:21+0300;От 1 года до 3 лет;Полный день;Полная занятость;"Акционерное общество «Уральский электромеханический завод», лидер Уральского региона в сфере изготовления электротехнической продукции, традиционной и атомной энергетики приглашает на работу инженера-программиста.Требования: Высшее образование (АСУП, АСУТП);Знание и опыт разработки в СУБД Oracle или Postgres;Опыт работы от 1 года.Обязанности:Консультация пользователей;Разработка технологии решения задачи по всем этапам обработки информации;Сопровождение и внедрение программных средств.Разработка дополнительных отчетов и модулей по заявкам подразделений.Мы предлагаем Вам: Официальное трудоустройство (полное соблюдение норм Трудового кодекса);Заработная плата от 34 000 руб.;Корпоративное обучение;Спортивно-культурные мероприятия;Нормированный рабочий день;Район работы: Пионерский (район УрФУ).«Благодарим Вас за интерес, проявленный к нашему предприятию. Срок рассмотрения резюме — 5 рабочих дней. Отсутствие ответа в течение этого времени означает, что, к сожалению, на сегодня у нас нет подходящих вакансий. При этом Ваше резюме будет сохранено в нашей базе данных и, если в дальнейшем вакансия появится, мы предложим ее Вам для рассмотрения».";;Высшее образование (АСУП, АСУТП). Знание и опыт разработки в СУБД Oracle или Postgres. Опыт работы от 1 года.;Консультация пользователей. Разработка технологии решения задачи по всем этапам обработки информации. Сопровождение и внедрение программных средств. Разработка дополнительных отчетов и...;
24;33997294;Инженер-программист;Омск;25000.0;;БУ ДПО ОО ЦПК РЗ;2019-10-09T10:46:33+0300;От 1 года до 3 лет;Полный день;Полная занятость;"Обязанности:  своевременное размещение актуальной и обновленной информации на официальном сайте учреждения, в т.ч. его администрирование; работа с организацией, предоставляющей услуги по обслуживанию и размещению официального сайта учреждения (хостинг); разработка и согласование технических спецификаций (заданий) на программные продукты; разработка инструкций по работе с программами, оформление необходимой технической документации; определение возможности использования нового программного обеспечения, в том числе введенных в эксплуатацию программных средств и их дальнейшее сопровождение.  Требования:  Высшее техническое образование администрирование программы «1С: Управление учебным центром», СЭД «Аврора» администрирование сайта организации  Условия:  Бюджетное учреждение, соц. пакет, пятидневная рабочая неделя с 08.30 да 17.00 ";  Бюджетное учреждение, соц. пакет, пятидневная рабочая неделя с 08.30 да 17.00 ;Высшее техническое образование.;Своевременное размещение актуальной и обновленной информации на официальном сайте учреждения, в т.ч. его администрирование. Работа с организацией, предоставляющей услуги...;"Администрирование сайтов; Документальное сопровождение; 1С: Документооборот; Разработка инструкций"
50;33384399;Инженер-программист;Самара;25000.0;;ГБУЗ Самарская областная детская клиническая больница имени Н.Н.Ивановой;2019-10-01T09:45:39+0300;От 1 года до 3 лет;Полный день;Полная занятость;Обязанности:  согласно должностной инструкции предприятия  Требования:  Высшее образование Информатика и вычислительная техника  Условия:  трудоустройство согласно ТК РФ ;  трудоустройство согласно ТК РФ ;"Высшее образование &quot;Информатика и вычислительная техника&quot;.";Согласно должностной инструкции предприятия.;
48;33795846;Инженер-программист;Самара;35000.0;;Алия;2019-09-26T17:04:12+0300;От 1 года до 3 лет;Полный день;Полная занятость;Обязанности:  Техническая поддержка информационной системы предприятия Общая техническая поддержка программного обеспечения на рабочих станциях Настройка новых технологий, интеграция информационной системы предприятия с внешними сервисами. Внедрение новых технологий, интеграция информационной системы предприятия с системой он-лайн бронирования и интернет-магазина Сопровождение 1С Предприятие, доработка печатных форм отчетов, обработка файлов. Сопровождение абонентских договоров телефонии и интернет-связи.  Требования:   стрессоустойчивость, ответственность, целеустремленность, коммуникабельность.  Условия:   График работы понедельник-пятница с 8.00 до 17.00 суббота,воскресенье - выходной. Заработная плата - от 35 000 руб.     ;   График работы понедельник-пятница с 8.00 до 17.00 суббота,воскресенье - выходной. Заработная плата - от 35 000 руб.     ;Стрессоустойчивость, ответственность, целеустремленность, коммуникабельность.;Техническая поддержка информационной системы предприятия. Общая техническая поддержка программного обеспечения на рабочих станциях. Настройка новых технологий, интеграция информационной системы предприятия...;"1С: Предприятие 8; Windows 7; Информационные технологии; 1С: Документооборот; Mac Os"
