;Index;id;name;city;min_salary;max_salary;company;days_from_publication;description;conditions;requirement;responsibility;key_skills;Тюмень;Челябинск;Казань;Екатеринбург;Другие города;experience_Более 6 лет;experience_Нет опыта;experience_От 1 года до 3 лет;experience_От 3 до 6 лет;schedule_Гибкий график;schedule_Полный день;schedule_Сменный график;schedule_Удаленная работа;employment_Полная занятость;employment_Проектная работа;employment_Стажировка;employment_Частичная занятость;Android;Java;Android SDK;Kotlin;Retrofit;Git;SQLite;ООП;SQL;Разработка ПО;Другие навыки
6;18;33958110;Начинающий программист Android;Ростов-на-Дону;1;1;ЗАЗЕКС;0.0;"Наша компания занимается предоставлением полного спектра услуг по разработке ПО для заказчиков со всего мира.Компания состоит из двух офисов – девелоперский центр в Ростове-на-Дону (он же головной офис) и офис продаж в Мельбурне, Австралия.Мы предоставляем услуги web-разработки, мобильной разработки, десктопной разработки, математического прикладного программирования, проектирования, тестирования и создания графического дизайна. Мы приглашаем на работу начинающего программиста Android в отдел мобильной и десктопной разработки в головной офис в Ростове-на-Дону. Требования:  Ответственность; Техническое образование (допускается неоконченное); Обучаемость; Опыт разработки ПО под мобильные платформы; Знание Java; Понимание ООП; Опыт работы с Android SDK; Опыт работы c HTTP, REST API и соответствующими библиотеками (OkHttp, Retrofit, etc).  Будет не лишним:  Опыт командной разработки; Умение работать с Git на базовом уровне; Умение разбираться в чужом коде.  Большим плюсом будет:  Базовое знание C/C++ и опыт сборки линуксовых C/C++ библиотек под NDK;  Опыт использования Google Play Services;  Знание принципов реактивного программирования и опыт применения соответствующих библиотек (RxJava, RxAndroid).  Условия:  Оформление согласно Трудовому Кодексу РФ; Только крупные и сложные проекты; Работа с инновационными технологиями, о которых другие компании боятся даже подумать; Большое количество коллег по цеху, скучать не будете; Система премирования (помимо указанного оклада выплачиваются ежемесячные премии согласно эффективности труда); Оплачиваемые переработки для трудоголиков (9-й и 10-й час в день по тарифу 150%‚ 11-й и далее по тарифу 200%); Возможность корпоративного обучения; Полный соц. пакет; Достойная заработная плата; Уважительное отношение к сотрудникам; Подвозка к месту работы/домой для жителей ЗЖМ; Свой повар + своя столовая; Большой, хороший‚ уютный офис в натуральном деревянном стиле с большим количеством зелени; Неограниченная парковка для сотрудников компании; Бесплатные снэки (перекусы); Доступный досуг (настольный футбол‚ PlayStation VR‚ Sega Mega Drive 2, турник‚ брусья‚ электрогитара‚ басуха‚ пианино, массажное кресло Yamaguchi YA-6000, свежий воздух); Офис вблизи транспортной развязки Квадро; Восьмичасовой рабочий день. Перерыв 1 час + два кофе-тайма по 15 минут; Если вы дочитали до этой строчки, то вот вам бонус: фактическая зарплата, как правило, выше, чем указанная в вакансии; Все вышеперечисленное - правда. ";"  Оформление согласно Трудовому Кодексу РФ; Только крупные и сложные проекты; Работа с инновационными технологиями, о которых другие компании боятся даже подумать; Большое количество коллег по цеху, скучать не будете; Система премирования (помимо указанного оклада выплачиваются ежемесячные премии согласно эффективности труда); Оплачиваемые переработки для трудоголиков (9-й и 10-й час в день по тарифу 150%‚ 11-й и далее по тарифу 200%); Возможность корпоративного обучения; Полный соц. пакет; Достойная заработная плата; Уважительное отношение к сотрудникам; Подвозка к месту работы/домой для жителей ЗЖМ; Свой повар + своя столовая; Большой, хороший‚ уютный офис в натуральном деревянном стиле с большим количеством зелени; Неограниченная парковка для сотрудников компании; Бесплатные снэки (перекусы); Доступный досуг (настольный футбол‚ PlayStation VR‚ Sega Mega Drive 2, турник‚ брусья‚ электрогитара‚ басуха‚ пианино, массажное кресло Yamaguchi YA-6000, свежий воздух); Офис вблизи транспортной развязки Квадро; Восьмичасовой рабочий день. Перерыв 1 час + два кофе-тайма по 15 минут; Если вы дочитали до этой строчки, то вот вам бонус: фактическая зарплата, как правило, выше, чем указанная в вакансии; Все вышеперечисленное - правда. ";Ответственность. Техническое образование (допускается неоконченное). Обучаемость. Опыт разработки ПО под мобильные платформы. Знание Java. Понимание ООП. Опыт работы с Android...;Мы предоставляем услуги web-разработки, мобильной разработки, десктопной разработки, математического прикладного программирования, проектирования, тестирования и создания графического дизайна. ;"Android SDK;Java;C++;Android;Git;ООП";0;0;0;0;1;0;1;0;0;0;1;0;0;1;0;0;0;1;1;1;0;0;1;0;1;0;0;1
7;80;34210713;Android - разработчик;Омск;2;0;Хроленко Андрей Геннадьевич;0.1;"Мы - HungryDev - компания, занимающаяся разработкой программного обеспечения. Специализация - разработка мобильных приложений.Ты нам нужен для:- Разработки новых продолжительных проектов;- Доработки функционала действующих проектов;- Профессионального развития в основных областях работы компании;- Соблюдения сроков и качества работы;- Поиска свежих подходов к решению задач. Для работы тебе понадобится: - Опыт коммерческой разработки под Android от 1 года;- Опыт работы со следующим стэком: Java Core, Java Concurrency, Java Collections; Android SDK, Fragments, Custom View, REST, XML, Retrofit, RxJava/Android, SQlite, Sockets, Long poll, Google Maps, Google Place, Geocoder.- Понимание MVC/MVP;- Обязательная разработка на Java. Опыт работы на kotlin будет большим плюсом От нас:- Испытательный срок в офисе, дальше – по твоему настроению;- Офис в центре города;- Гибкий график (обсуждается индивидуально);- Чай, кофе в офисе за счёт компании;- Активная корпоративная жизнь и отличный молодой коллектив;- Достойный заработок, который будет напрямую зависеть от результатов твоего труда;- Бонусы за хорошую работу;- Рост заработной платы пропорционален твоему профессиональному развитию. Не откликайся на вакансию, если ты:- Любишь ныть и жаловаться. Нам нужны люди, которые готовы брать ответственность на себя, а не искать, на кого ее переложить.- Считаешь, что все знаешь и умеешь. Мы считаем, что обучение - это базовая ценность профессионала. Нам нужны те, кто хотят учиться, учатся много и внедряют полученные знания на практике.- После выполнения текущей задачи «успокаиваешься» в ожидании “пинка” или новой порции задач. Нет! Мы ждем от тебя неустанной инициативы.- Не пунктуален и не ценишь время свое и окружающих. Ты нам точно подходишь, если: - Умеешь, привык и готов работать на результат.- Очень любишь и умеешь изучать новое и постоянно стремишься стать лучше.";;Для работы тебе понадобится: - Опыт коммерческой разработки под Android от 1 года. - Опыт работы со следующим стэком: Java Core, Java...;Разработки новых продолжительных проектов. - Доработки функционала действующих проектов. - Профессионального развития в основных областях работы компании. - Соблюдения сроков и качества работы. - ;"Android;Android SDK;Java;Java SE;SQLite";0;0;0;0;1;0;0;1;0;1;0;0;0;1;0;0;0;1;1;1;0;0;0;1;0;0;0;1
8;41;33914801;Android - Разработчик;Казань;3;3;Mircod;0.0;Компания Mircod занимается разработкой комплексных IoT решений для различных сфер деятельности, включающих в себя электронные гаджеты, мобильные и WEB приложения, а также облачные сервисы. Приглашаем присоединиться к нашей амбициозной команде опытного и такого же амбициозного разработчика. Обязанности:  Разработка и поддержка мобильных приложений, которые работают с устройствами по интерфейсу Bluetooth/WiFi, отображают данные на экране и синхронизируют их с облаком  Требования:  Отличное знание Java Понимание принципов ООП, Clean Architecture RxJava REST API Опыт разработки клиент серверных приложений (Retrofit, OkHttp) Умение работать с ORM решениями для хранения данных Уверенная работа с системой контроля версий Git  Приветствуется:  Знание Kotlin Опыт использования Bluetooth LE в проектах Опыт работы с Firebase Знание C/C++, JNI  Условия:  Работа над интересными проектами Уютный офис в центре Казани Дружный и высококвалифицированный коллектив Перспективы карьерного роста и профессионального развития в молодой компании Тренажерный зал в здании офиса для сотрудников Бесплатные занятия английским Обилие различных вкусностей для поддержания тонуса ;  Работа над интересными проектами Уютный офис в центре Казани Дружный и высококвалифицированный коллектив Перспективы карьерного роста и профессионального развития в молодой компании Тренажерный зал в здании офиса для сотрудников Бесплатные занятия английским Обилие различных вкусностей для поддержания тонуса ;Отличное знание Java. Понимание принципов ООП, Clean Architecture. RxJava. REST API. Опыт разработки клиент серверных приложений (Retrofit, OkHttp). ;Разработка и поддержка мобильных приложений, которые работают с устройствами по интерфейсу Bluetooth/WiFi, отображают данные на экране и синхронизируют их...;"RxJava;C/C++;Retrofit;OkHttp;ORM;Kotlin;Android;Intellij IDEA";0;0;1;0;0;0;0;1;0;0;1;0;0;1;0;0;0;1;0;0;1;1;0;0;0;0;0;1
9;77;33437477;Senior Android - разработчик;Самара;4;5;МодульБанк;0.0;"Привет! Мы делаем лучший банк для настоящих предпринимателей.MODULBANK это не просто банк или приложение, это полноценный партнер для бизнесмена.Простой, Мощный, Красивый. Наш центр разработки клиентских приложений в Уфе и Новосибирске - у нас уже есть сильная профессиональная команда, которая хочет расширяться. Backlog ломится от наших идей и продуктов. Мы ищем аndroid разработчика как в офис так и для удаленной работы. Мы тебя ждем, если ты - аndroid разработчик, влюбленный в свое дело- обладаешь опытом разработки мобильных приложений- желаешь взяться за создание самого лучшего на рынке банковского приложения, которое полюбят клиенты- любишь использовать в работе самые современные подходы и техники- интересуешься трендами в мобильной разработке   Твои ключевые задачи - проектирование и проработка технических решений и архитектуры, их реализация- разработка и поддержка мобильного приложения на платформе Android- разработка удобного и понятного для пользователей интерфейса по макету предоставленному дизайнером- постоянное взаимодействие с другими командами, для совместного решения задач- участие в развитии команды: от улучшения процессов до найма новых сотрудников Обязательные знания/опыт - понимание современных тенденций в мобильной разработке- отличное знание Java/Kotlin и Android SDK;- знание ООП, паттернов проектирования ПО- знание шаблонов проектирования пользовательских интерфейсов- опыт анализа и профилирования приложений- опыт работы с сетевыми протоколами (HTTP, REST, JSON и др.)- опыт разработки клиент-серверных приложений- опыт написания unit тестов, понимание того как писать тестируемый код Желательно - опыт работы с библиотеками Moxy, Dagger2, RxJava2- ссылки на проекты в Play Market, профили GitHub и StackOverflow- знание принципов Agile-разработки- умение работать с git, CI/CD системами Что мы предлагаем - молодая сильная команда. Мы собрались чтобы изменить банкинг для предпринимателей- гибкий график. Мы не работаем с 9 до 18, мы работаем на результат- финансовые пряники. Зарплата обсуждается по результатам собеседования. Нам нужны профессионалы,- обучение, семинары, тренинги, конференции, корпоративная библиотека.- ДМС- корпоративные скидки. Мы ценим - влюбленных в свое дело людей- командную работу- профессионализм.";;аndroid разработчик, влюбленный в свое дело. - обладаешь опытом разработки мобильных приложений. - любишь использовать в работе самые современные подходы и техники. - ;Твои ключевые задачи. - проектирование и проработка технических решений и архитектуры, их реализация. - разработка и поддержка мобильного приложения на платформе Android. - ;"Android;Java;SQL";0;0;0;0;1;0;0;0;1;0;1;0;0;1;0;0;0;1;1;0;0;0;0;0;0;1;0;0
10;56;33437476;Senior Android - разработчик;Челябинск;4;1;МодульБанк;0.0;"Привет! Мы делаем лучший банк для настоящих предпринимателей.MODULBANK это не просто банк или приложение, это полноценный партнер для бизнесмена.Простой, Мощный, Красивый. Наш центр разработки клиентских приложений в Уфе и Новосибирске - у нас уже есть сильная профессиональная команда, которая хочет расширяться. Backlog ломится от наших идей и продуктов. Мы ищем аndroid разработчика как в офис так и для удаленной работы. Мы тебя ждем, если ты - аndroid разработчик, влюбленный в свое дело- обладаешь опытом разработки мобильных приложений- желаешь взяться за создание самого лучшего на рынке банковского приложения, которое полюбят клиенты- любишь использовать в работе самые современные подходы и техники- интересуешься трендами в мобильной разработке   Твои ключевые задачи - проектирование и проработка технических решений и архитектуры, их реализация- разработка и поддержка мобильного приложения на платформе Android- разработка удобного и понятного для пользователей интерфейса по макету предоставленному дизайнером- постоянное взаимодействие с другими командами, для совместного решения задач- участие в развитии команды: от улучшения процессов до найма новых сотрудников Обязательные знания/опыт - понимание современных тенденций в мобильной разработке- отличное знание Java/Kotlin и Android SDK;- знание ООП, паттернов проектирования ПО- знание шаблонов проектирования пользовательских интерфейсов- опыт анализа и профилирования приложений- опыт работы с сетевыми протоколами (HTTP, REST, JSON и др.)- опыт разработки клиент-серверных приложений- опыт написания unit тестов, понимание того как писать тестируемый код Желательно - опыт работы с библиотеками Moxy, Dagger2, RxJava2- ссылки на проекты в Play Market, профили GitHub и StackOverflow- знание принципов Agile-разработки- умение работать с git, CI/CD системами Что мы предлагаем - молодая сильная команда. Мы собрались чтобы изменить банкинг для предпринимателей- гибкий график. Мы не работаем с 9 до 18, мы работаем на результат- финансовые пряники. Зарплата обсуждается по результатам собеседования. Нам нужны профессионалы,- обучение, семинары, тренинги, конференции, корпоративная библиотека.- ДМС- корпоративные скидки. Мы ценим - влюбленных в свое дело людей- командную работу- профессионализм.";;аndroid разработчик, влюбленный в свое дело. - обладаешь опытом разработки мобильных приложений. - любишь использовать в работе самые современные подходы и техники. - ;Твои ключевые задачи. - проектирование и проработка технических решений и архитектуры, их реализация. - разработка и поддержка мобильного приложения на платформе Android. - ;"Android;Java;SQL";0;1;0;0;0;0;0;0;1;0;1;0;0;1;0;0;0;1;1;0;0;0;0;0;0;1;0;0
