;Index;id;name;city;min_salary;max_salary;company;days_from_publication;description;conditions;requirement;responsibility;key_skills;Тюмень;Челябинск;Казань;Екатеринбург;Другие города;experience_Более 6 лет;experience_Нет опыта;experience_От 1 года до 3 лет;experience_От 3 до 6 лет;schedule_Гибкий график;schedule_Полный день;schedule_Сменный график;schedule_Удаленная работа;employment_Полная занятость;employment_Проектная работа;employment_Стажировка;employment_Частичная занятость;Android;Java;Android SDK;Kotlin;Retrofit;Git;SQLite;ООП;SQL;Разработка ПО;Другие навыки
11;74;32961844;Android разработчик;Екатеринбург;0;0;СКБ ЛАБ;0.0;SKB_Lab - это передовой IT-проект. Он создан для разработки абсолютно нового интернет-банка и мобильных приложений для него, как для физических, так и для юридических лиц. Если говорить про философию работы, то мы применяем agile подходы. Исходя из этого, можно сказать, что мы гибкие - у каждого есть возможность влиять на принятие решений в проектах! Вся команда, вместе с руководством, находится в офисе в Екатеринбурге, что, несомненно, влияет на скорость принятия решений, и отсутствие бюрократии. Обязанности:  Разработка нового функционала приложений. Написание кода, построение и переработка архитектуры приложения.  Мы ждем от вас:  Опыт нативной разработки для Android от 1 года. Уверенное знание Java, Android SDK. Мы используем: Kotlin, Cicerone, Toothpick, RxJava, Moxy, Retrofit и кое-что еще. Инструменты: YouTrack, Slack, UpSource, Zeplin. Умение работать с системой контроля версий, CI. Знание классических алгоритмов и структур данных. Желателен опыт реализации собственных проектов под Android. Знание любой другой из мобильных платформ приветствуется. Стремление повышать собственный уровень профессиональной квалификации. Знание технического английского языка.  Условия:  Заработная плата, которая будет радовать (уровень дохода зависит от ваших навыков и технических знаний). Премии (не только по итогам года). Даем простор в развитии «профессиональной мускулатуры», предлагая работу вместе с профессионалами. Мы можем доверить вам участие в развитии наших продуктов, возможность предлагать идеи и технологии. Предлагаем возможность участия в мероприятиях для профессионального развития. Конференции, тренинги, учебные курсы. Обустроим для вас удобное рабочее место с современной техникой. Компенсируем занятия спортом. Оплатим паркинг, если вы на машине, а если машины нет, то мы оплатим ваш проезд на общественном транспорте (дадим безлимитную Е-карту) и припаркуем ваш велосипед. Мы располагаемся в отличном офисе с великолепным панорамным видом на город. На кофе-поинте вас всегда будут ждать плюшки и свежий кофе. Мы даже подумали о том, как вы будете расслабляться в офисе: у нас есть зоны релакса, массажист, душ, кикер, аэрохоккей, боксёрская груша и гимнастический станок. Мы отладили все наши процессы таким образом, чтобы вас не тревожили вопросы бюрократии.  Мы ценим:   Тех, кто уважает мнение Заказчика. Тех, кто не боится ответственности. Тех, кто работает на результат. Тех, кто не требует микроменеджмента и постоянного менторства. Тех, кто сказал, что все будет готово в пятницу, и финишировал в четверг вечером. Тех, кто готов делиться своим опытом. Красивый код.  Ждем Вас в нашем офисе! Обсудим больше подробностей.;  Заработная плата, которая будет радовать (уровень дохода зависит от ваших навыков и технических знаний). Премии (не только по итогам года). Даем простор в развитии «профессиональной мускулатуры», предлагая работу вместе с профессионалами. Мы можем доверить вам участие в развитии наших продуктов, возможность предлагать идеи и технологии. Предлагаем возможность участия в мероприятиях для профессионального развития. Конференции, тренинги, учебные курсы. Обустроим для вас удобное рабочее место с современной техникой. Компенсируем занятия спортом. Оплатим паркинг, если вы на машине, а если машины нет, то мы оплатим ваш проезд на общественном транспорте (дадим безлимитную Е-карту) и припаркуем ваш велосипед. Мы располагаемся в отличном офисе с великолепным панорамным видом на город. На кофе-поинте вас всегда будут ждать плюшки и свежий кофе. Мы даже подумали о том, как вы будете расслабляться в офисе: у нас есть зоны релакса, массажист, душ, кикер, аэрохоккей, боксёрская груша и гимнастический станок. Мы отладили все наши процессы таким образом, чтобы вас не тревожили вопросы бюрократии.  Мы ценим:   Тех, кто уважает мнение Заказчика. Тех, кто не боится ответственности. Тех, кто работает на результат. Тех, кто не требует микроменеджмента и постоянного менторства. Тех, кто сказал, что все будет готово в пятницу, и финишировал в четверг вечером. Тех, кто готов делиться своим опытом. Красивый код.  Ждем Вас в нашем офисе! Обсудим больше подробностей.;Опыт нативной разработки для Android от 1 года. Уверенное знание Java, Android SDK. Мы используем: Kotlin, Cicerone, Toothpick, RxJava, Moxy...;Разработка нового функционала приложений. Написание кода, построение и переработка архитектуры приложения.;"Agile Project Management;Обучение персонала;Redmine;Android;Android SDK;Java;kotlin";0;0;0;1;0;0;0;1;0;1;0;0;0;1;0;0;0;1;1;1;0;0;0;0;0;0;0;1
12;57;32646654;Android developer;Омск;2;0;Центр Цифровых Коммуникаций;0.0;"Наша команда активно растет и прямо сейчас в ней есть место для Android Developer, который может, умеет, практикует…  Java/Kotlin под Android с практическим опытом от 2 лет и навыками разработки архитектуры приложений и проектирования,Android SDK, API 21+, Material Design, Design Patterns; понимает принципы ООП и SOLID, параллельного и многопоточного программирования; разбирается в разработке клиент-серверных приложений; имеет опыт работает с Retrofit2, RXjava2, а также git и git flow; на практике использует в приложениях облачные сервисы.  Плюсом будет:  опыт писать unit-тесты; опыт работы с записью/воспроизведением/оптимизацией видео/аудио; желание делать качественный коммерческий продукт; внимание к деталям; готовность работать на результат и ответственность; знание технического английского.  Работа в нашей команде - это:  уникальный опыт создания, запуска и развития продукта на зарубежных рынках; увлекательные задачи, возможность использовать самые современные технологии разработки и исследований; честная зарплата и социальный пакет (отпускные, больничные, все необходимые налоговые отчисления, программа ДМС); широки возможности профессионального развития и обучения. ";;Java/Kotlin под Android с практическим опытом от 2 лет и навыками разработки архитектуры приложений и проектирования,Android SDK, API...;;"Android;Java;Android SDK;Kotlin;Retrofit";0;0;0;0;1;0;0;1;0;0;0;0;1;1;0;0;0;1;1;1;1;1;0;0;0;0;0;0
13;91;32597486;Android разработчик;Омск;2;0;Ronas IT;0.13333333333333333;"Обязанности:  разработка мобильных приложений под платформу Android.  Требования:  опыт разработки на Kotlin; опыт работы с Android SDK; опыт работы с системами сборки проектов (Grade/Maven); знание гайдлайнов; опыт работы с SQL (SQLite); работа с форматами передачи данных XML, JSON; ​желание развиваться.  Приветствуется:  опыт работы в команде; опыт работы с системами контроля версий; опыт проектной работы, адекватная оценка задач и сроков; опыт разработки под iOS.  Условия:  интересные проекты для различных иностранных компаний; просторный офис в самом центре города, открытый 24/7; свободный рабочий график; возможность совмещать работу и учебу; полный социальный пакет; обучение английскому языку за счет компании; программа компенсации затрат на обеды; программа компенсации медицинских расходов; пересмотр уровня зарплаты минимум раз в год; конкурентная заработная плата. ";"  интересные проекты для различных иностранных компаний; просторный офис в самом центре города, открытый 24/7; свободный рабочий график; возможность совмещать работу и учебу; полный социальный пакет; обучение английскому языку за счет компании; программа компенсации затрат на обеды; программа компенсации медицинских расходов; пересмотр уровня зарплаты минимум раз в год; конкурентная заработная плата. ";Опыт разработки на Kotlin. Опыт работы с Android SDK. Опыт работы с системами сборки проектов (Grade/Maven). Знание гайдлайнов. ;Разработка мобильных приложений под платформу Android.;"Android;Java;Android SDK;Kotlin;Retrofit";0;0;0;0;1;0;0;1;0;1;0;0;0;1;0;0;0;1;1;1;1;1;0;0;0;0;0;0
14;94;32218679;Senior Android разработчик;Омск;2;0;Ronas IT;0.13333333333333333;"Обязанности:  разработка мобильных приложений под платформу Android.  Требования:  опыт разработки на Java или Kotlin; опыт работы с Android SDK; опыт работы с системами сборки проектов (Grade/Maven); знание гайдлайнов; опыт работы с SQL (SQLite); работа с форматами передачи данных XML, JSON; лидерские качества; ​желание развиваться.  Приветствуется:  опыт работы в команде; опыт работы с системами контроля версий; опыт проектной работы; умение адекватно оценивать задачи и сроки их выполнения; опыт разработки под iOS.  Условия:  интересные проекты для различных иностранных компаний; просторный офис в самом центре города, открытый 24/7; свободный рабочий график; полный социальный пакет; обучение английскому языку за счет компании; программа компенсации затрат на обеды; программа компенсации медицинских расходов; конкурентная заработная плата.   ";"  интересные проекты для различных иностранных компаний; просторный офис в самом центре города, открытый 24/7; свободный рабочий график; полный социальный пакет; обучение английскому языку за счет компании; программа компенсации затрат на обеды; программа компенсации медицинских расходов; конкурентная заработная плата.   ";Опыт разработки на Java или Kotlin. Опыт работы с Android SDK. Опыт работы с системами сборки проектов (Grade/Maven). ;Разработка мобильных приложений под платформу Android.;"Android;Java;Android SDK;Kotlin;Retrofit";0;0;0;0;1;1;0;0;0;1;0;0;0;1;0;0;0;1;1;1;1;1;0;0;0;0;0;0
15;70;32942395;Android разработчик;Ростов-на-Дону;1;3;ПКБ;0.23333333333333334;"Обязанности:  Разработка мобильных приложений  Требования:  Высшее; Опыт работы на аналогичной должности – от 2 лет; Английский язык на уровне чтения документации; Уверенные знания Android SDK, RXJava, Dagger, Retrofit, DataBindings, WebSocket. Желателен опыт работы с Realm, MVI, Kotlin, написание Unit Test  Условия:  Официальное трудоустройство согласно ТК РФ Белая зп ( оклад+ бонус ) Возможность профессионального развития ";  Официальное трудоустройство согласно ТК РФ Белая зп ( оклад+ бонус ) Возможность профессионального развития ;Высшее. Опыт работы на аналогичной должности – от 2 лет. Английский язык на уровне чтения документации. Уверенные знания Android SDK, RXJava...;Разработка мобильных приложений.;"Android SDK;RXJava;Dagger;Retrofit;DataBindings;WebSocket;Разработка мобильных приложений";0;0;0;0;1;0;0;1;0;0;1;0;0;1;0;0;0;0;0;1;0;1;0;0;0;0;0;1
16;94;34102778;Android-разработчик (Middle / Senior);Ростов-на-Дону;1;3;Бастион;0.0;"В рамках компании Бастион стремительно развивается направление разработки программного обеспечения для приборов собственного производства : оборудование для систем безопасности как частных домовладений, так и крупных объектов, оборудование для систем отопления, аквариумов и др. Обязанности:  Проектирование и разработка мобильных приложений для выпускаемых компанией приборов в соответствии с техническим заданием Декомпозиция и оценка задач по разработке Оформление и документирование результатов разработки в соответствии с внутренними стандартами компании.  Требования:  Знание принципов ООП Опыт разработки Android-приложений, наличие своих приложений в Play Market, готовность их продемонстрировать. Знание технического английского в объёме достаточном, для изучения технической документации. Умение проектировать приложения с разделением кода на слои. Умение структурировать и документировать код и архитектуру приложений; Опыт проектирования пользовательского интерфейса. Навыки управления командой разработчиков - желательно Опыт работы в кросс-платформенных разработках будет плюсом  Условия:  Работа в офисе. График: пн-пт с 9 до 18 часов Стабильная заработная плата. Уровень заработной платы обсуждается на собеседовании и зависит от навыков и умений кандидата. Оформление согласно ТК РФ Возможность обучения и повышения своей квалификации за счет Компании ";  Работа в офисе. График: пн-пт с 9 до 18 часов Стабильная заработная плата. Уровень заработной платы обсуждается на собеседовании и зависит от навыков и умений кандидата. Оформление согласно ТК РФ Возможность обучения и повышения своей квалификации за счет Компании ;Умение структурировать и документировать код и архитектуру приложений. Опыт проектирования пользовательского интерфейса. Навыки управления командой разработчиков - желательно. Опыт работы в...;Проектирование и разработка мобильных приложений для выпускаемых компанией приборов в соответствии с техническим заданием. Декомпозиция и оценка задач по разработке. ;"Android;Проектирование пользовательских интерфейсов;ООП";0;0;0;0;1;0;0;1;0;0;1;0;0;1;0;0;0;1;0;0;0;0;0;0;1;0;0;1
