;Index;id;name;city;min_salary;max_salary;company;days_from_publication;description;conditions;requirement;responsibility;key_skills;Тюмень;Челябинск;Казань;Екатеринбург;Другие города;experience_Более 6 лет;experience_Нет опыта;experience_От 1 года до 3 лет;experience_От 3 до 6 лет;schedule_Гибкий график;schedule_Полный день;schedule_Сменный график;schedule_Удаленная работа;employment_Полная занятость;employment_Проектная работа;employment_Стажировка;employment_Частичная занятость;SQL;Delphi;SVN;Borland Delphi;MS SQL Server;Transact-SQL;Embarcadero Delphi;DB2;программирование C#;программирование delphi;Другие навыки
6;83;32718116;Программист Delphi;Санкт-Петербург;2;2;Компания Инфоcтрой;0.03333333333333333;Обязанности:  Разработка, сопровождение и реинжиниринг программного обеспечения Компании.  Требования:  Минимальные навыки:  понимание и практическое владение методологией объектно-ориентированного программирования. опыт разработки приложений баз данных знание Delphi или С# знание MS SQL Server умение разбираться в чужом коде     Приветствуется:  опыт работы в команде знание и опыт использования СОМ-технологии опыт использования DevExpress, знакомство с InstallShield, FastReport опыт разработки многопоточных приложений опыт использования nUnit знание .Net    Мы предлагаем:  Дружный молодой коллектив. Интересные и сложные задачи. Отсутствие бюрократии. Оформление по ТК РФ Зарплата: оклад + бонус по итогам работы компании за квартал Испытательный срок 3 мес. ;  Дружный молодой коллектив. Интересные и сложные задачи. Отсутствие бюрократии. Оформление по ТК РФ Зарплата: оклад + бонус по итогам работы компании за квартал Испытательный срок 3 мес. ;Минимальные навыки: Понимание и практическое владение методологией объектно-ориентированного программирования. Опыт разработки приложений баз данных. Знание Delphi или С#. ;Разработка, сопровождение и реинжиниринг программного обеспечения Компании.;"SQL;Delphi;SVN;Borland Delphi;MS SQL Server";0;0;0;0;1;0;0;1;0;0;1;0;0;1;0;0;0;1;1;1;1;1;0;0;0;0;0;0
7;28;33276266;Программист-разработчик Delphi;Казань;2;3;Межрегиональный клинико-диагностический центр (МКДЦ);0.03333333333333333;"Обязанности:  Поддержка, доработка и разработка компонентов медицинской информационной системы (Delphi XE7); Составление SQL запросов для выборки данных из баз DB2, а также знание оптимизации SQL запросов, умение создавать хранимые процедуры, триггеры, индексы; Написание медицинских отчетов в генераторах (Crystal Reports, Fast Reports и т. п.).  Требования:  Высшее техническое образование; Знание DB2, SQL, Delphi XE7; Личные качества: самообучаемость, ответственность, инициативность, исполнительность, креативность, пунктуальность и умение работать в команде.  Условия:  Уровень заработной платы: от 50 тыс.руб.; Полный социальный пакет (оформление по ТК, оплата больничных листков, отпусков), регулярно выплачиваемая заработная плата два раза в месяц; Предоставление детского дня один раз в месяц и ко дню знаний для родителя первоклассника; Льготное медицинское обслуживание как для сотрудника, так и для близких родственников сотрудника; Забота о детях сотрудников МКДЦ: мастер-классы, содействие в организации летнего отдыха, подарки к новому году и ко дню знаний для первоклассника; Богатая программа корпоративных мероприятий; Бесплатное посещение бассейна; График работы: 5/2, с 9.00 до 17.30 или с 8.00 до 16.30, или с 8.30 до 17.00; Работа на территории работодателя. ";"  Уровень заработной платы: от 50 тыс.руб.; Полный социальный пакет (оформление по ТК, оплата больничных листков, отпусков), регулярно выплачиваемая заработная плата два раза в месяц; Предоставление детского дня один раз в месяц и ко дню знаний для родителя первоклассника; Льготное медицинское обслуживание как для сотрудника, так и для близких родственников сотрудника; Забота о детях сотрудников МКДЦ: мастер-классы, содействие в организации летнего отдыха, подарки к новому году и ко дню знаний для первоклассника; Богатая программа корпоративных мероприятий; Бесплатное посещение бассейна; График работы: 5/2, с 9.00 до 17.30 или с 8.00 до 16.30, или с 8.30 до 17.00; Работа на территории работодателя. ";Высшее техническое образование. Знание DB2, SQL, Delphi XE7. Личные качества: самообучаемость, ответственность, инициативность, исполнительность, креативность, пунктуальность и умение...;Поддержка, доработка и разработка компонентов медицинской информационной системы (Delphi XE7). Составление SQL запросов для выборки данных из баз DB...;"Delphi;SQL;DB2";0;0;1;0;0;0;0;0;1;0;1;0;0;1;0;0;0;1;1;0;0;0;0;0;1;0;0;0
8;44;32968737;Программист Delphi;Челябинск;3;0;Челябинский Трубопрокатный Завод, (ЧТПЗ);0.0;"Сфера деятельности: Информационные технологии Вакансия открыта в компании АО ДиАйПи, которая входит в промышленную группу ЧТПЗ. Обязанности:  разработка и сопровождение задач ERP систем  Требования:  высшее образование: Информатика и вычислительная техника. Бизнес- информатика, Фундаментальная информатика и информационные технологии, Прикладная математика; хорошее знание SQL, приветствуется знание PL/SQL. опыт работы с СУБД Oracle, Microsoft SQL опыт разработки приложений в среде Delphi, Visual Studio. знание языков программирования Delphi,C#. приветствуется знания Crystal Reports, FastReports и других генераторов отчётов. приветствуется опыт интеграции/сопровождения гетерогенных систем хранения и обработки данных. приветствуется знания механизмов репликации и распределённых баз данных. желателен опыт командной работы над проектами английский язык на уровне чтения технической документации;  Условия работы:  вакансия открыта в компании АО ДиАйПи, которая входит в промышленную группу ЧТПЗ. официальное трудоустройство, полное соблюдение ТК; постоянная штатная единица; рабочее место в Заводоуправлении ПАО ЧТПЗ (г. Челябинск, ул. Машиностроителей); график работы: ПН-ПТ с 8:30 до 17:15, ненормированный рабочий день; заработная плата по результатам собеседования; ежемесячная премия по результатам работы возможность профессионального и карьерного роста и развития; ";;Высшее образование: Информатика и вычислительная техника. Бизнес- информатика, Фундаментальная информатика и информационные технологии, Прикладная математика. Хорошее знание SQL, приветствуется знание...;Разработка и сопровождение задач ERP систем.;"программирование C#;программирование delphi";0;1;0;0;0;0;0;1;0;0;1;0;0;1;0;0;0;0;0;0;0;0;0;0;0;1;1;0
9;32;34199203;Программист Delphi, Oracle PL/SQL;Самара;0;0;Чакона;0.13333333333333333;Обязанности: Участие в разработке ERP- Системы предприятияИнтеграция приложений со сторонними сервисами Требования: Основные требования:Высшее техническое образование.Опыт работы в IDE Borland/Embarcadero Delphi не меньше 3-х летЗнания принципов ООП, интерфейсыОпыт работы с потокамиОтличное знание языка SQLОпыт работы с БД Oracle (PL/SQL)Умение самостоятельно проводить анализ и диагностику проблем, находить решения для сложных и нестандартных задач Дополнительные знания: Работа с OLE объектамиПостроение отчётов в FastReportРабота с системой контроля версий SVN Условия: График работы: 5/2Уровень заработной платы конкурентный (определяется по результатам собеседования); График работы: 5/2Уровень заработной платы конкурентный (определяется по результатам собеседования);Высшее техническое образование. Опыт работы в IDE Borland/Embarcadero Delphi не меньше 3-х лет. Знания принципов ООП, интерфейсы. ;Участие в разработке ERP- Системы предприятия. Интеграция приложений со сторонними сервисами. Работа с OLE объектами. Построение отчётов в FastReport. ;"Oracle Pl/SQL;SVN;Borland Delphi;SQL;Delphi";0;0;0;0;1;0;0;0;1;0;1;0;0;1;0;0;0;1;1;1;1;0;0;0;0;0;0;1
10;57;34234419;Программист Java/Delphi;Тюмень;0;0;Бюджетные и Финансовые Технологии;0.06666666666666667;"Компания Бюджетные и Финансовые Технологии - ведущий разработчик в сфере управленческих и информационных технологий для органов власти приглашает на работу на должность Программист Java/Delphi      Обязанности: • Поддержка и развитие серверной части ядра АЦК (Java 8 SE), включая Delphi клиент.   АЦК-Финансы - система управления общественными финансами для муниципальных образований высокого уровня. Документооборот. Представлена линейкой продуктов реализованных на базе внутреннего фреймворка - «Ядро». Трехзвенная архитектура. Включает подсистемы: электронной подписи, отчетов, множество интеграций.   Требования: • Высшее образование (IT); • Java 8 SE, опыт разработки ERP-систем; • Опыт работы с СУБД: оптимизация работы, выявление причин сбоев/тормозов (Oralce, FireBird, PostgreSQL); • Опыт работы с git; • Опыт работы в большой команде; • Опыт реверс-инжиниринга; • Готовность работать с кодом Delphi.   Желательно:   • Опыт разработки HighLoad-систем (Java); • Опыт работы на Delphi: использования интерфейсов, оптимизации, CORBA и CryptoAPI; • JavaScript (native JS, AJAX, devtools браузера).     Условия:   • Официальное трудоустройство в рамках ТК РФ; • Официальная заработная плата; • Профессиональный коллектив, перспективы роста и развития; • Корпоративное обучение за счет Компании; • ДМС; • Чай‚ кофе для поддержания хорошего настроения.  ";"   • Официальное трудоустройство в рамках ТК РФ; • Официальная заработная плата; • Профессиональный коллектив, перспективы роста и развития; • Корпоративное обучение за счет Компании; • ДМС; • Чай‚ кофе для поддержания хорошего настроения.  ";Высшее образование (IT). Java 8 SE, опыт разработки ERP-систем. Опыт работы с СУБД: оптимизация работы, выявление причин сбоев/тормозов...;Поддержка и развитие серверной части ядра АЦК (Java 8 SE), включая Delphi клиент. Чай‚ кофе для поддержания хорошего настроения.;"SQL;Delphi;SVN;Borland Delphi;MS SQL Server";1;0;0;0;0;0;0;0;1;0;1;0;0;1;0;0;0;1;1;1;1;1;0;0;0;0;0;0
