;Index;id;name;city;min_salary;max_salary;company;days_from_publication;description;conditions;requirement;responsibility;key_skills;Тюмень;Челябинск;Казань;Екатеринбург;Другие города;experience_Более 6 лет;experience_Нет опыта;experience_От 1 года до 3 лет;experience_От 3 до 6 лет;schedule_Гибкий график;schedule_Полный день;schedule_Сменный график;schedule_Удаленная работа;employment_Полная занятость;employment_Проектная работа;employment_Стажировка;employment_Частичная занятость;JavaScript;CSS;HTML;HTML5;Git;CSS3;jQuery;AngularJS;React;Node.js;Другие навыки
24;7;33222051;Frontend-разработчик;Тюмень;1;3;CDS Company;0.0;"CDS Company - студия веб-разработок.Мы специализируемся на разработке крупных проектов, регионального и федерального уровня.Мы разрабатываем высоконагруженные интернет-магазины, CRM-системы для различных предприятий, профессиональные корпоративные порталы, модернизируем порталы СМИ и много других сложных, нетривиальных проектов. В разработке мы используем передовые технологии и крутые решения технического характера. В разработке используем нашу внутреннюю CRM систему для оптимизации внутренних бизнес-процессов. На сегодняшний день разработано и запущено свыше 50 проектов и находится более 100 сайтов на технической поддержке. На текущий момент набираем команду программистов для развития своих кодерских навыков и для разработки крутых проектов в связи с расширением штата и увеличением объема работ. Есть team-lead, наставник, который справится с любой задачей и любым вопросом. Обязанности: - Верстка проектов с нуля по дизайн-макетам PSD;- Доработки верстки существующих проектов;- Адаптация макетов под мобильные устройства;- Написание JS-скриптов на базе jQuery;- Оптимизация работы HTML/CSS/JS для ускорения работы сайтов; Требования: - Базовые знания web-разработки;- Знание JavaScript, JQuery;- Знание HTML5;- Знание CSS3.0;- Знание SASS;- Сборка на базе Node.js c таск-менеджером Gulp;- Знание Pug/Jade;- Базовые знания JavaScript, jQuery;- Пунктуальность;- Ответственность;- Не бояться учиться чему-то новому; Условия: - Работа в офисе в будни, график вы устанавливаете себе сами;- Перерыв на обед - 1 час в любое время;- Предоставляем рабочее место с хорошим компьютером (2 монитора, производительный компьютер);- За Вами будет закреплен руководитель, который будет помогать решать технические вопросы и руководить процессом разработки;- Обучение и повышение квалификации;- Официальное трудоустройство минимум после 2 месяцев испытательного срока;- Чай и печеньки за наш счет;- Корпоративчики и пятничные посиделки;- Офис в центре города;- Корпоративное жилье для иногородних;- Соц.пакет: выплата больничных, выплата отпускных, выплата квартальных премий, мед. страховка; На текущем этапе развития компании гарантируем карьерный рост до руководителя отдела разработки и выше.";" - Работа в офисе в будни, график вы устанавливаете себе сами;- Перерыв на обед - 1 час в любое время;- Предоставляем рабочее место с хорошим компьютером (2 монитора, производительный компьютер);- За Вами будет закреплен руководитель, который будет помогать решать технические вопросы и руководить процессом разработки;- Обучение и повышение квалификации;- Официальное трудоустройство минимум после 2 месяцев испытательного срока;- Чай и печеньки за наш счет;- Корпоративчики и пятничные посиделки;- Офис в центре города;- Корпоративное жилье для иногородних;- Соц.пакет: выплата больничных, выплата отпускных, выплата квартальных премий, мед. страховка; На текущем этапе развития компании гарантируем карьерный рост до руководителя отдела разработки и выше.";Базовые знания web-разработки. - Знание JavaScript, JQuery. - Знание HTML5. - Знание CSS3.0. - Знание SASS. - Знание Pug/Jade. - ;Верстка проектов с нуля по дизайн-макетам PSD. - Доработки верстки существующих проектов. - Адаптация макетов под мобильные устройства. - Написание JS-скриптов...;"PHP;jQuery;CSS3;1С-Битрикс;CSS;ООП;MySQL;CMS Wordpress;HTML;HTML5;JavaScript;Ajax";1;0;0;0;0;0;0;1;0;0;1;0;0;1;0;0;0;1;1;1;1;0;1;1;0;0;0;1
25;53;34239265;Frontend - программист;Санкт-Петербург;2;3;VisitWeb;0.06666666666666667;Вакансия Frontend - программиста в компанию, разрабатывающую несколько интересных проектов. Формируем профессиональную команду, силами которой планируется развивать различные актуальные проекты на самом современном уровне технологий. Требуемый опыт работы: 1–3 года Полная занятость, гибкий график Обязанности:  Разработка Frontend-а для наших будущих проектов.  Поддержка/доработка Frontend-а текущих проектов.   Требования:   Уверенные знания JavaScript, html и css.   Опыт разработки пользовательских интерфейсов.   Опыт работы в команде.   Преимуществом будет:   Знание Vue, Vue-Router, Vuex.   Знание Bootstrap, ES6.   Знание git.   Опыт работы с webSocket.   Опыт использования Webpack   Опыт работы с Unix / Linux.   Опыт разработки SPA.   Понимание как работают Веб-сервер / браузер / SPA.   Мы используем:   Vue + Vuex + Vue-router, Axios, Socket-IO.   php7 / Laravel.   GoLang.   Debian / Nginx.   Условия:   Достойное вознаграждение, обсуждается по результатам собеседования   График 5/2   Современный офис, комфортное рабочее место   Команда профессионалов, интересные и масштабные задачи   Корпоративные мероприятия (яхтинг, кёрлинг, пикники и пр.)  ;   Достойное вознаграждение, обсуждается по результатам собеседования   График 5/2   Современный офис, комфортное рабочее место   Команда профессионалов, интересные и масштабные задачи   Корпоративные мероприятия (яхтинг, кёрлинг, пикники и пр.)  ;Уверенные знания JavaScript, html и css. Опыт разработки пользовательских интерфейсов. Опыт работы в команде. Знание Vue, Vue-Router, Vuex. ;Разработка Frontend-а для наших будущих проектов. Поддержка/доработка Frontend-а текущих проектов.;"Git;JavaScript;Bootstrap;Linux;CSS";0;0;0;0;1;0;0;1;0;1;0;0;0;1;0;0;0;1;1;0;0;1;0;0;0;0;0;1
26;92;34191751;Javascript Developer;Омск;2;3;БитСофт;0.13333333333333333;"  Компания BeetSoft более 7-ми лет на международном рынке web-разработки. Основные ценности - это наша команда, клиенты и качество наших проектов. В связи с расширением штата, компания BeetSoft в поисках JS-разработчиков. Что требуется от вас:  уверенные знания Node.js; умение работать с системами контроля версий (Git); выполнение поставленных задач и последующее их тестирование; планирование и соблюдение сроков; изучение новых технологий, необходимых для работы на проектах.  Дополнительным плюсом будет:  опыт работы с современными JavaScript фреймворками (Angular, React, Vue.js, etc); навыки написания unit тестов; опыт работы с Docker; владение английским языком на уровне чтения и понимания требований к задаче.    Что предлагаем мы:  просторный офис компании в центре города (высокая транспортная доступность); учет ваших пожеланий к оборудованию рабочего места; удобный график (40-часовая рабочая неделя, рабочий день начинается до 12.00); официальное трудоустройство; оплачиваемый больничный, отпуск, компенсация неиспользованных дней отпуска; отсутствие лишней бюрократии; интересные задачи различной сложности; различные приятные бонусы от компании.   ";;Уверенные знания Node.js. Умение работать с системами контроля версий (Git). Опыт работы с современными JavaScript фреймворками (Angular, React, Vue.js, etc). ;Выполнение поставленных задач и последующее их тестирование. Планирование и соблюдение сроков. Изучение новых технологий, необходимых для работы на проектах.;"JavaScript;Node.js;AngularJS";0;0;0;0;1;0;0;1;0;1;0;0;0;1;0;0;0;1;0;0;0;0;0;0;1;0;1;0
27;71;30906701;Front-End Разработчик;Ростов-на-Дону;1;3;Офисный Мир КМ;0.36666666666666664;"Необходимые умения и навыки: Generic  БЭМ и какие проблемы он решает (в БЭМ не нужно знание как именно работают фреймворки от Яндекс, просто для чего БЭМ нужен); Не бояться немного погружаться в серверную шаблонизацию Знание и понимание CanIUse; Выстраивание отношений с backend разработчиками;  JS  Знание ООП; Знание основ ES6, замыкания; Знание что такое Bind и когда он теряется, как избежать; DOM модель, события в браузере; Babel, для чего он нужен, уметь настраивать Webpack для сборки проекта (знать принципы сборки, систему импортов, уметь анализировать размер бандла); Gulp - основы (бывает нужен) Знание React;    CSS  Знание CSS - каскад и его проблемы, препроцессоры, в частности SCSS, так же есть проекты с Less; Верстка на флоатах и инлайн блоках (поддержка IE9);    Требования:  опыт работы в аналогичной должности от года! Высшее образование; Обеспечение профессионального подхода к процессам внедрения и разработки; Опыт применения большинства из представленного выше стека технологий.  Условия:   Заработная плата обсуждается индивидуально с успешным кандидатом; Работа в головном офисе компании по адресу пр. Театральный; Нормированный рабочий день с 9:00 до 17:30; Оплачиваемый отпуск, оплачиваемый больничный; Оформление по ТК РФ; Корпоративное обучение английскому языку; Премии по итогам работы.   ";"   Заработная плата обсуждается индивидуально с успешным кандидатом; Работа в головном офисе компании по адресу пр. Театральный; Нормированный рабочий день с 9:00 до 17:30; Оплачиваемый отпуск, оплачиваемый больничный; Оформление по ТК РФ; Корпоративное обучение английскому языку; Премии по итогам работы.   ";Необходимые умения и навыки: Generic. БЭМ и какие проблемы он решает (в БЭМ не нужно знание как именно работают фреймворки...;Выстраивание отношений с backend разработчиками. Верстка на флоатах и инлайн блоках (поддержка IE9).;"JavaScript;CSS;HTML;HTML5;Git";0;0;0;0;1;0;0;1;0;0;1;0;0;1;0;0;0;1;1;1;1;1;0;0;0;0;0;0
28;99;34203746;Middle Frontend Developer;Челябинск;2;3;Infinnity Solutions;0.1;"Ищем неравнодушного frontend-разработчика для долговременного сотрудничества. Команда frontend-разработки уже укомплектована несколькими специалистами и с удовольствием примет в свои ряды нового участника для работы над интересными активными проектами.Обязанности:Разработка клиентской части новых продуктов компании, а так же поддержка существующих (преимущественно на Angular)Требования:  Хорошее знание JavaScript, Html5, css3 Опыт в разработке одностраничных приложений (идеально, если использовался Angular) Умение разбираться в чужом коде Понимание принципов проектирования архитектуры (паттерны проектирования, принципы SOLID)  Желательно:Опыт работы с typescript или другими типизироваными языками программированияЧто предстоит делать:  Разработка на Angular, SCSS Участие на SCRUM-мероприятиях: планирования, стендапы, ретроспективы.  Условия:  Просторный офис на с/з, современное оборудование. В офисе есть все необходимое для продуктивной работы (удобные рабочие места,конференц-зал и переговорная комната) и отдыха (столовая с доступом к кофе, чаю и сливкам, душевая, зона отдыха с массажным креслом и пр.); Официальное трудоустройство, график работы и условия труда в соответствии с ТК РФ Уровень заработной платы – до 100 000 рублей, по итогам собеседования; Регулярный пересмотр заработной платы и стабильная выплата заработной платы; Возможность профессионального и карьерного роста; Дополнительное обучение, тренинги, конференции, курсы за счет компании; Корпоративные программы спорта; Дружный, весёлый и профессиональный коллектив; Частые оплачиваемые корпоративы. ";"  Просторный офис на с/з, современное оборудование. В офисе есть все необходимое для продуктивной работы (удобные рабочие места,конференц-зал и переговорная комната) и отдыха (столовая с доступом к кофе, чаю и сливкам, душевая, зона отдыха с массажным креслом и пр.); Официальное трудоустройство, график работы и условия труда в соответствии с ТК РФ Уровень заработной платы – до 100 000 рублей, по итогам собеседования; Регулярный пересмотр заработной платы и стабильная выплата заработной платы; Возможность профессионального и карьерного роста; Дополнительное обучение, тренинги, конференции, курсы за счет компании; Корпоративные программы спорта; Дружный, весёлый и профессиональный коллектив; Частые оплачиваемые корпоративы. ";Хорошее знание JavaScript, Html5, css3. Опыт в разработке одностраничных приложений (идеально, если использовался Angular). Умение разбираться в чужом...;Разработка клиентской части новых продуктов компании, а так же поддержка существующих (преимущественно на Angular). Разработка на Angular, SCSS. ;"Angular;JavaScript;HTML5;CSS3";0;1;0;0;0;0;0;1;0;0;1;0;0;1;0;0;0;1;0;0;1;0;1;0;0;0;0;1
29;38;33572864;Frontend-разработчик;Казань;2;3;Flatstack;0.06666666666666667;"Flatstack - международная IT-компания, создающая программное обеспечение на Ruby on Rails, iOS и Android, с офисами в Казани, Новом Орлеане и Варшаве. Мы работаем над множеством заказов для клиентов США и Европы, и мы приглашаем всех желающих присоединится к нам! Что мы предлагаем:  Серьезно поставленный процесс разработки; Прозрачная отточенная система оценки и карьерного роста; Комфортный уютный офис в центре города; Современно оборудованное рабочее место; Курсы английского языка, по желанию; Дружный коллектив специалистов; Event-ы компании и вкусняшки на кухне; Проект благодарностей от коллег (Rewards Flatstack) за отличную работу; Приятная надбавка за стаж работы в компании; Наличие диплома и военного билета для нас не принципиально.  Дополнительно:  Финансируем покупку личного макбука, если есть желание носить его на работу; Помогаем с релокацией, если хочется переехать в Казань: найти и взять в аренду жильё, поможем с оплатой первых месяцев.    Чем мы занимаемся во Front-end отделе:  Работа над действующими и новыми Javascript/Rails-проектами; Написание бизнес логики; Верстка сайтов по исходным PSD/Sketch-макетам; Создаем интерфейсы и верстаем их под мобильные устройства.    Мы расширяем штат сотрудников в разных проектах и приглашаем профессионалов владеющих:  AngularJS/Angular7 (используемые технологии в проектах CoffeeScript, TypeScript, Sprockets, Cloud66); Vue/React; HTML/CSS/JS.  Что мы ожидаем от будущих коллег:  Опыт работы с одним из фреймворков: Vue / React / AngularJS / Angular7; Опыт работы с ES6/ES7; Шаблонизаторы (Slim); CSS процессоры (SASS, SCSS, LESS, PostCSS); Canvas/ SVG.  Отличным дополнением будет, если есть:   Понимание структуры Rails приложений; Знание особенности кроссбраузерной верстки, адаптивной верстки и верстки под мобильные устройства; Понимание модели MVC/MV* Знание английского на уровне, достаточном для чтения технической документации.    Если вас заинтересовало наше предложение:  продемонстрируйте нам свои профессиональные навыки, выполнив тестовое задание.   Еще больше информации о наших проектах: 1) Амбициозные стартапы: TrailSee, HealthTab, Niko Niko, Bar Notes; 2) Компании, которые сосредоточены на активном развитии продукта: Roadtrippers, GoGreenRide, DatAvail, Cinetis; 3) Компании с большой базой пользователей и высоконагруженными сервисами: ACL, Williams-Sonoma, Amtrak, KLM/Air France.";;AngularJS/Angular7 (используемые технологии в проектах CoffeeScript, TypeScript, Sprockets, Cloud66). Vue/React. HTML/CSS/JS. Опыт работы с...;Работа над действующими и новыми Javascript/Rails-проектами. Написание бизнес логики. Верстка сайтов по исходным PSD/Sketch-макетам. ;"AngularJS;Angular7;React;HTML5;CSS3;JavaScript;MVC;MV;ES6;ES7;CoffeeScript;TypeScript;Slim;Sass;SCSS;Less;PostCSS;CSS;Canvas;SVG;Rails;Sprockets;Cloud66";0;0;1;0;0;0;0;1;0;1;0;0;0;1;0;0;0;1;1;0;1;0;1;0;1;1;0;1
