;Index;id;name;city;min_salary;max_salary;company;days_from_publication;description;conditions;requirement;responsibility;key_skills;Тюмень;Челябинск;Казань;Екатеринбург;Другие города;experience_Более 6 лет;experience_Нет опыта;experience_От 1 года до 3 лет;experience_От 3 до 6 лет;schedule_Гибкий график;schedule_Полный день;schedule_Сменный график;schedule_Удаленная работа;employment_Полная занятость;employment_Проектная работа;employment_Стажировка;employment_Частичная занятость;JavaScript;CSS;HTML;HTML5;Git;CSS3;jQuery;AngularJS;React;Node.js;Другие навыки
85;46;34129589;Front-end разработчик;Омск;2;3;Народная Компания Открытый Дом (ООО);0.0;Мы приглашаем в штат нашей Компании специалиста для поддержки и развития сайтов, которые помогают нашим клиентам эффективно реализовывать проекты. Чем предстоит заняться:  Поддержка frontend проекта OPENh на React. Разработка дополнительного функционала проекта.  Для этого вам потребуются:   Желание и умение разбираться в чужом коде.   Устойчивый опыт работы с системой контроля версий Git.   Знание механизмов Gitlab CI.   Уверенные знания Html, CSS, Java Script.   Опыт работы с React (Vue JS, Angular), Type Script, а так же Redux, Node JS, Vue, Postgres QL, Graph QL.  Пытливость и заинтересованность. Стремление учиться и постигать новое, желание делать более сложные проекты.  Мы готовы предложить:   Оформление трудовых отношений согласно ТК РФ, выплата з/п два раза в месяц, оплачиваемый отпуск, больничный.   Возможность карьерного роста до заместителя директора.   Возможность профессионального роста - амбициозные задачи, постоянно прирастающие по количеству и качеству.   Профильное обучение по запросу сотрудников.   Удобные рабочие места с современным оборудованием, зонами отдыха.   Трудоспособный коллектив, уважительные отношения между коллегами.   Красивый статусный офис в историческом центре нашего города с удобной парковкой.   Условия оплаты труда обсуждаются с успешными кандидатами в процессе предварительных собеседований с руководством компании. Договоренности закрепляются в Трудовом договоре.    ;;Желание и умение разбираться в чужом коде. Устойчивый опыт работы с системой контроля версий Git. Знание механизмов Gitlab CI. ;Поддержка frontend проекта OPENh на React. Разработка дополнительного функционала проекта.;"JavaScript;CSS;HTML;HTML5;Git";0;0;0;0;1;0;0;1;0;0;1;0;0;1;0;0;0;1;1;1;1;1;0;0;0;0;0;0
86;49;30973470;Senior Frontend developer;Омск;2;3;Ronas IT;0.0;"Обязанности:  разработка веб-сервисов.    Требования:  опыт программирования на JavaScript и TypeScript; опыт работы хотя бы с одним фреймворком: AngularJS, Angular, React.JS, Vue; знание английского языка на уровне чтения технической документации; желание развиваться.    Приветствуется:  опыт работы в команде; опыт использования Linux; опыт работы с системами контроля версий; опыт проектной работы; умение оценивать задачи и сроки их выполнения.  Условия:  дружеская атмосфера; интересные проекты для различных иностранных компаний; просторный офис в самом центре города, открытый 24/7; свободный рабочий график; полный социальный пакет; обучение английскому языку за счет компании; программа компенсации затрат на обеды; программа компенсации медицинских расходов; конкурентная заработная плата. ";"  дружеская атмосфера; интересные проекты для различных иностранных компаний; просторный офис в самом центре города, открытый 24/7; свободный рабочий график; полный социальный пакет; обучение английскому языку за счет компании; программа компенсации затрат на обеды; программа компенсации медицинских расходов; конкурентная заработная плата. ";Опыт программирования на JavaScript и TypeScript. Опыт работы хотя бы с одним фреймворком: AngularJS, Angular, React.JS, Vue. Знание английского языка...;Разработка веб-сервисов.;"JavaScript;CSS;HTML;HTML5;Git";0;0;0;0;1;0;0;0;1;1;0;0;0;1;0;0;0;1;1;1;1;1;0;0;0;0;0;0
87;61;20661160;Разработчик JavaScript;Омск;2;3;Ronas IT;0.03333333333333333;"Обязанности:  разработка веб-сайтов и мобильных приложений.    Требования:  опыт программирования на JavaScript; опыт работы хотя бы с одним фреймворком: AngularJS, React.JS, Vue или Angular; знание английского языка на уровне чтения технической документации; желание развиваться.    Приветствуется:  опыт работы в команде; опыт работы с NodeJS; опыт программирования на PHP/RoR; опыт использования Linux; опыт работы с системами контроля версий; опыт проектной работы; умение оценивать задачи и сроки их выполнения.  Условия:  дружеская атмосфера; интересные проекты для различных иностранных компаний; просторный офис в самом центре города, открытый 24/7; свободный рабочий график; возможность совмещать работу и учебу; полный социальный пакет; обучение английскому языку за счет компании; программа компенсации затрат на обеды; программа компенсации медицинских расходов; конкурентная заработная плата. ";"  дружеская атмосфера; интересные проекты для различных иностранных компаний; просторный офис в самом центре города, открытый 24/7; свободный рабочий график; возможность совмещать работу и учебу; полный социальный пакет; обучение английскому языку за счет компании; программа компенсации затрат на обеды; программа компенсации медицинских расходов; конкурентная заработная плата. ";Опыт программирования на JavaScript. Опыт работы хотя бы с одним фреймворком: AngularJS, React.JS, Vue или Angular. Знание английского языка на...;Разработка веб-сайтов и мобильных приложений.;"JavaScript;CSS;HTML;HTML5;Git";0;0;0;0;1;0;0;1;0;1;0;0;0;1;0;0;0;1;1;1;1;1;0;0;0;0;0;0
88;63;21950976;NodeJS разработчик;Омск;2;3;Ronas IT;0.03333333333333333;"Обязанности:  разработка веб-сайтов и мобильных приложений    Требования:  опыт программирования на JavaScript; опыт работы с NodeJS; опыт работы с базами данных, владение SQL; знание английского языка на уровне чтения технической документации; желание развиваться.    Приветствуется:  опыт работы хотя бы с одним фреймворком: AngularJS, React.JS, Vue или Angular; опыт работы в команде; опыт программирования на PHP/RoR; опыт использования Linux; опыт работы с системами контроля версий; опыт проектной работы; умение оценивать задачи и сроки их выполнения.    Условия:  дружеская атмосфера; интересные проекты для различных иностранных компаний; просторный офис в самом центре города, открытый 24/7; свободный рабочий график; возможность совмещать работу и учебу; полный социальный пакет; обучение английскому языку за счет компании; программа компенсации затрат на обеды; программа компенсации медицинских расходов; конкурентная заработная плата. ";"  дружеская атмосфера; интересные проекты для различных иностранных компаний; просторный офис в самом центре города, открытый 24/7; свободный рабочий график; возможность совмещать работу и учебу; полный социальный пакет; обучение английскому языку за счет компании; программа компенсации затрат на обеды; программа компенсации медицинских расходов; конкурентная заработная плата. ";Опыт программирования на JavaScript. Опыт работы с NodeJS. Опыт работы с базами данных, владение SQL. Знание английского языка на уровне...;Разработка веб-сайтов и мобильных приложений.;"JavaScript;CSS;HTML;HTML5;Git";0;0;0;0;1;0;0;1;0;1;0;0;0;1;0;0;0;1;1;1;1;1;0;0;0;0;0;0
89;93;27619742;Middle Frontend developer;Омск;2;3;Ronas IT;0.13333333333333333;"Обязанности:  разработка веб-сервисов.    Требования:  опыт программирования на JavaScript и TypeScript; опыт работы хотя бы с одним фреймворком: AngularJS, Angular, React.JS, Vue; знание английского языка на уровне чтения технической документации; желание развиваться.    Приветствуется:  опыт работы в команде; опыт использования Linux; опыт работы с системами контроля версий; опыт проектной работы; умение оценивать задачи и сроки их выполнения.  Условия:  дружеская атмосфера; интересные проекты для различных иностранных компаний; просторный офис в самом центре города, открытый 24/7; свободный рабочий график; возможность совмещать работу и учебу; полный социальный пакет; обучение английскому языку за счет компании; программа компенсации затрат на обеды; программа компенсации медицинских расходов; конкурентная заработная плата. ";"  дружеская атмосфера; интересные проекты для различных иностранных компаний; просторный офис в самом центре города, открытый 24/7; свободный рабочий график; возможность совмещать работу и учебу; полный социальный пакет; обучение английскому языку за счет компании; программа компенсации затрат на обеды; программа компенсации медицинских расходов; конкурентная заработная плата. ";Опыт программирования на JavaScript и TypeScript. Опыт работы хотя бы с одним фреймворком: AngularJS, Angular, React.JS, Vue. Знание английского языка...;Разработка веб-сервисов.;"JavaScript;CSS;HTML;HTML5;Git";0;0;0;0;1;0;0;1;0;1;0;0;0;1;0;0;0;1;1;1;1;1;0;0;0;0;0;0
90;96;32632439;Senior Frontend developer;Омск;2;3;ЦИАН ГРУПП;0.13333333333333333;"ЦИАН – лидирующий на рынке маркетплейс по недвижимости России (по данным LiveInternet за январь 2018 года). Мы помогаем найти жилье более чем 11 миллионам посетителей ежемесячно. ЦИАН пятый год подряд входит в двадцатку самых дорогих компаний Рунета по версии журнала Forbes. Мы каждый день работаем над тем, чтобы наш сервис был полезен, удобен и надежен для любого сегмента наших пользователей. Поэтому мы ищем амбициозных людей, кто сможет предложить свои идеи и захочет воплотить в жизнь уже существующие. Что делает Frontend разработчик:  разрабатывает клиентскую часть веб-сайтов и веб-приложений; участвует в разработке и внедрении новых сервисов и технологий; взаимодействует с командой backend-разработчиков; верстает для desktop и мобильных браузеров; дополняет и разрабатывает общий style guide компании; оптимизирует работу текущего UI; пишет понятный и поддерживаемый другими участниками команды код.  Должен уметь:  работать с React; разработать задачу от начала и до конца; пользоваться Git (работа с ветками, решение конфликтов); автоматизировать свою работу используя Unix shell и другие подручные средства; находить причину возникновения любой ошибки на сайте; реализовать компонент любой сложности; применять ES2015+; желательно:  умеет писать unit тесты; знает о Typescript; имеет опыт работы с Node.js.    Работа в ЦИАН - это:  Удаленная работа, оформление по ТК 5 day off в год Профессиональный рост (ЛПР, оплачиваемое обучение, посещение конференций, корпоративная библиотека) Мы любим веселиться (2 больших корпоратива в год + квартальные вечеринки в офисе) ";;Работать с React. Разработать задачу от начала и до конца. Пользоваться Git (работа с ветками, решение конфликтов). Автоматизировать свою работу...;Участвует в разработке и внедрении новых сервисов и технологий. Взаимодействует с командой backend-разработчиков. Верстает для desktop и мобильных браузеров. ;"Git;JavaScript;Node.js;HTML5;CSS3";0;0;0;0;1;0;0;0;1;0;0;0;1;1;0;0;0;1;0;0;1;1;1;0;0;0;1;0
91;56;29491586;React/Vue.js-разработчик;Ростов-на-Дону;1;2;АйТи Консалт;0.03333333333333333;"Международная компания ProgForce (Россия/Израиль/США), специализирующаяся в разработке программного обеспечения, приглашает на работу программистов. Требования:  Отличное знание JavaScript; Опыт создания Vuejs или Reactjs приложений; Умение пользоваться системой контроля версий Git; Умение писать чистый, производительный и поддерживаемый JavaScript; Умение анализировать и решать сложные задачи; Навык планирования сроков и их соблюдения; Приветствуется знание английского.  Условия:   Работа в международной компании.   Интересные проекты, профессиональный рост, новые технологии.   Белая з/п   Работа на территории работодателя (пн-пт с 9:00 до 18:00)   Приятная демократичная атмосфера в компании   Своя кухня (чай/кофе)   Комфортабельный офис в центре города   Корпоративные мероприятия с семьями  ";   Работа в международной компании.   Интересные проекты, профессиональный рост, новые технологии.   Белая з/п   Работа на территории работодателя (пн-пт с 9:00 до 18:00)   Приятная демократичная атмосфера в компании   Своя кухня (чай/кофе)   Комфортабельный офис в центре города   Корпоративные мероприятия с семьями  ;Отличное знание JavaScript. Опыт создания Vuejs или Reactjs приложений. Умение пользоваться системой контроля версий Git. Умение писать чистый, производительный и...;;"JavaScript;Git;React;Vue.js";0;0;0;0;1;0;0;1;0;0;1;0;0;1;0;0;0;1;0;0;0;1;0;0;0;1;0;1
92;57;33793585;Frontend-разработчик;Ростов-на-Дону;1;2;GrowApp Solutions;0.06666666666666667;Обязанности:  Вёрстка Разработка Frontend на Angular  Требования:  Agular 8, HTML5, CSS3, Typescript, JavaScript Сборщики и бандлеры для статики, желательна автоматическая генерация клиентского кода по документации Swagger.  Условия:  Интересные проекты Комфортный офис Хорошую атмосферу и адекватное управление Трудоустройство по ТК РФ Оплачиваемые больничные и отпуска Профессиональный и карьерный рост. ;  Интересные проекты Комфортный офис Хорошую атмосферу и адекватное управление Трудоустройство по ТК РФ Оплачиваемые больничные и отпуска Профессиональный и карьерный рост. ;Agular 8, HTML5, CSS3, Typescript, JavaScript.;Вёрстка. Разработка Frontend на Angular. Сборщики и бандлеры для статики, желательна автоматическая генерация клиентского кода по документации Swagger.;"ООП;Git;HTML5;JavaScript;Bootstrap;CSS3";0;0;0;0;1;0;0;0;1;0;1;0;0;1;0;0;0;1;0;0;1;1;1;0;0;0;0;1
93;77;29491514;Back-end разработчик (Node.js);Ростов-на-Дону;1;2;АйТи Консалт;0.3333333333333333;"Международная компания ProgForce (Россия/Израиль/США), специализирующаяся в разработке программного обеспечения, приглашает на работу программистов. Требования:  Знание Node.js, NoSQL или SQL; Основы работы с Git; Отличное знание JavaScript; Опыт работы в среде *nix; Иметь представление об асинхронном программировании; Опыт разработки на Node.js; Способность разбираться в чужом коде, быстро понимать поставленную задачу; Приветствуется знание английского; Дополнительным плюсом будет знание react/vue.js  Условия:   Работа в международной компании.   Интересные проекты, профессиональный рост, новые технологии.   Белая з/п   Работа на территории работодателя (пн-пт с 9:00 до 18:00)   Приятная демократичная атмосфера в компании   Своя кухня (чай/кофе)   Комфортабельный офис в центре города   Корпоративные мероприятия с семьями  ";   Работа в международной компании.   Интересные проекты, профессиональный рост, новые технологии.   Белая з/п   Работа на территории работодателя (пн-пт с 9:00 до 18:00)   Приятная демократичная атмосфера в компании   Своя кухня (чай/кофе)   Комфортабельный офис в центре города   Корпоративные мероприятия с семьями  ;Знание Node.js, NoSQL или SQL. Основы работы с Git. Отличное знание JavaScript. Опыт работы в среде *nix. Иметь представление об...;;"JavaScript;Git;SQL;NoSQL;Node.js";0;0;0;0;1;0;0;1;0;0;1;0;0;1;0;0;0;1;0;0;0;1;0;0;0;0;1;1
