;Index;id;name;city;min_salary;max_salary;company;days_from_publication;description;conditions;requirement;responsibility;key_skills;Тюмень;Челябинск;Казань;Екатеринбург;Другие города;experience_Более 6 лет;experience_Нет опыта;experience_От 1 года до 3 лет;experience_От 3 до 6 лет;schedule_Гибкий график;schedule_Полный день;schedule_Сменный график;schedule_Удаленная работа;employment_Полная занятость;employment_Проектная работа;employment_Стажировка;employment_Частичная занятость;Java;Spring Framework;PostgreSQL;SQL;HTML;Git;Intellij IDEA;JavaScript;JDBC;ООП;Другие навыки
20;91;34270030;Java-разработчик;Самара;4;3;VOICE Communication;0.0;"Voice Communication – высокотехнологичная компания, работающая на рынке голосовых технологий с 2009 года. Обладает богатым опытом реализации проектов в области распознавания и синтеза речи, голосовой биометрии. В компании выделен отдельный RD департамент, занимающийся разработкой новых продуктов, применением инновационных технологий (в том числе искусственный интеллект) в существующих и потенциальных проектах. Мы создали уникальный продукт MAIC System, обладающий большим потенциалом и широким перечнем. Суть продукта – эмуляция работы оператора контактного центра, ведение разговора с абонентом по заранее заложенной логике с использованием технологий искусственного интеллекта, распознавания и синтеза речи. http://lab.voice-com.ru/index.html В настоящий момент мы расширяем команду, отвечающую за разработку программного обеспечения Работа удаленно Чем именно предстоит заниматься:  разработка многоуровневых Web-приложений, с реализацией серверов на Java;   участие в определении и выборе архитектурных и технических решений в проектах.  Наш идеал обладает следующими качествами:  опыт в данной области от 3 лет; опыт работы в реальных проектах разработки ПО на Java; знание архитектуры современных Web-приложений с Java-серверами – плюс в карму; знание и опыт разработки на Java – обязательно; знание и опыт работы с Spring Framework, Spring Boot; опыт использования ORM-решений, библиотек уровня слоя хранения в Java, желательно знание MyBatis: опыт использования gradle; знания и опыт в разработке Java-сервера для Web-приложений; желательны знания и опыт в СУБД PostgreSQL; умения находить проектные решения для бизнес-задач; желание изучать новые технологии, находить и предлагать новые решения; ответственность за принятые решения; уважение к срокам проекта.  Взамен мы обеспечим тебя всеми возможными благами цивилизации, ведь у нас:  Возможность работать из дома; Заработная плата, которая растет вместе с твоими компетенциями; Молодой веселый коллектив и адекватное начальство; Реальная возможность профессионального и карьерного роста.    Просим обратить внимание, что перед интервью Вам необходимо будет выполнить наше тестовое задание ";;Опыт в данной области от 3 лет. Опыт работы в реальных проектах разработки ПО на Java. Знание архитектуры современных Web...;Разработка многоуровневых Web-приложений, с реализацией серверов на Java. Участие в определении и выборе архитектурных и технических решений в проектах.;"Java;PostgreSQL;ORM;Spring Framework";0;0;0;0;1;0;0;0;1;0;0;0;1;1;0;0;0;1;1;1;0;0;0;0;0;0;0;1
21;94;33895657;Java-разработчик;Самара;4;3;IT2G;0.03333333333333333;"В связи с открытием Самарского офиса, в команду требуются Java-разработчики уровня middle и выше. Мы предлагаем:  Гибкое начало дня Работа в комфортном офисе Кофе из кофемашины, чай, фрукты, йогурты, бутерброды в течение дня не ограничено Оформление по ТК РФ Полугодовые премии по результату работы  Обязанности:  Разработка новых функциональных возможностей системы; Рефакторинг кода; Контроль интеграционных зависимостей со смежными ИС; Участие в проектировании архитектуры приложений и баз данных; Написание unit-тестов;  Требования:  Обязательные  Опыт от 2 лет Java SE 7 и выше (Collections, Exception handling, Synchronization, JDBC) SQL (Oracle или PostgreSQL) HTTP, HTTPS, Log4j или Logback Apache Tomcat или Eclipse Jetty или JBoss App Server или другой app server ООП Web сервисы (REST или SOAP).   Будет плюсом  AngularJS 1.6+   ";"  Гибкое начало дня Работа в комфортном офисе Кофе из кофемашины, чай, фрукты, йогурты, бутерброды в течение дня не ограничено Оформление по ТК РФ Полугодовые премии по результату работы  Обязанности:  Разработка новых функциональных возможностей системы; Рефакторинг кода; Контроль интеграционных зависимостей со смежными ИС; Участие в проектировании архитектуры приложений и баз данных; Написание unit-тестов;  Требования:  Обязательные  Опыт от 2 лет Java SE 7 и выше (Collections, Exception handling, Synchronization, JDBC) SQL (Oracle или PostgreSQL) HTTP, HTTPS, Log4j или Logback Apache Tomcat или Eclipse Jetty или JBoss App Server или другой app server ООП Web сервисы (REST или SOAP).   Будет плюсом  AngularJS 1.6+   ";Обязательные. Опыт от 2 лет. Java SE 7 и выше (Collections, Exception handling, Synchronization, JDBC). SQL (Oracle или PostgreSQL). ;Разработка новых функциональных возможностей системы. Рефакторинг кода. Контроль интеграционных зависимостей со смежными ИС. Участие в проектировании архитектуры приложений и баз...;"Java;PostgreSQL;JDBC;Java SE;Spring Framework;ООП;REST;SOAP;ORACLE;Hibernate ORM";0;0;0;0;1;0;0;1;0;0;1;0;0;1;0;0;0;1;1;1;0;0;0;0;0;1;1;1
22;15;33725700;Программист Java;Казань;2;3;Provectus;0.03333333333333333;  Provectus is looking for an experienced Java Developer to join our team. About project You will be crafting advanced backend platform based on Microservices architecture and “Netflix stack”. The platform disrupts legacy corporate travel market and promises to become an Expedia for B2B in upcoming years. Requirements  Java 8+ Spring Framework + Spring Boot 1.5/2.0 + Spring Security Hibernate/JOOQ Swagger GRPC and Protobuf Docker Maven MySQL  Will be a plus  ELK stack Grafana OpenZipkin Amazon Web Services Kafka or Kinesis ElasticSearch, Redis, Redshift, CouchBase Amazon Athena or PrestoDB  Grow yourself  Formula 1 - dedicated program for employees who want to develop managerial skills Data Science Meetups - talks among scientists to create close-to-scientific Rewarding the most active speakers by certificates for attending the most popular conferences at the end of the year Attendance at any conference as speaker Employee development and training programs (Soft Skills  Hard Skills Club) Corporate English School Expert Fridays every month  Have fun  Board games, darts, table tennis and recreation areas in office Great variety of drinks and snacks, fruit and ice cream in the office kitchen area A great corporate culture full of events and parties  Nice to have  Medical insurance or sport subscription in any training club of the city for all employees Corporate MacBook after passing the approbation period Nice souvenirs for newcomers Food Day on Tuesdays - there is such a thing like free lunch! Demo Days on Thursdays - informal small talks on programming topics Gifts for newly married couples and young parents Comfortable working place in coworking space Flexible schedule Corporate trips to USA ;;Java 8+. Spring Framework + Spring Boot 1.5/2.0 + Spring Security. Hibernate/JOOQ. Swagger. ;Formula 1 - dedicated program for employees who want to develop managerial skills. Data Science Meetups - talks among scientists to create...;"Java;Spring Framework;PostgreSQL;SQL;HTML";0;0;1;0;0;0;0;0;1;0;1;0;0;1;0;0;0;1;1;1;1;1;0;0;0;0;0;0
23;12;34058808;Java-разработчик;Тюмень;3;4;IT2G;0.06666666666666667;Обязанности:   Участие в проектах по разработке интеграционных и BPM-решений, систем документооборота на базе Java EE.   Участие в проектировании архитектуры информационных систем, подготовка внутренней документации.   Проектирование и реализация компонентов информационных систем.   Требования:   Опыт от 2 лет.   Java SE 7 или 8 (Collections, Exception handling, Synchronization, Lambda Expressions).   Spring, Spring MVC. Понимание Servlet API.   Проектирование и разработка Web сервисов (обязательно REST и желательно SOAP). Понимание принципов работы HTTP(S).Apache Tomcat или Eclipse Jetty или другой app server.   Понимание ООП, SOLID-принципов.   Умение строить SQL запросы.     Базовые навыки Javascript.   Взамен мы предлагаем:   молодой и дружный коллектив.   график работы: 5/2 с 9.00 до 18.00 с возможностью его сдвигать.   оформление в строгом соответствии ТК РФ.   оклад + полугодовые премии.   спортивные и культурные мероприятия.   возможность кадрового и экспертного роста.   компенсации и Льготы   мотивационная программа признания заслуг   оплата мобильной связи     обучение в индивидуальном и корпоративном форматах.   Условия:   полный рабочий день.   конкурентоспособная заработная плата по результатам собеседования.   оформление по ТК РФ.  ;   полный рабочий день.   конкурентоспособная заработная плата по результатам собеседования.   оформление по ТК РФ.  ;Опыт от 2 лет. Java SE 7 или 8 (Collections, Exception handling, Synchronization, Lambda Expressions). Spring, Spring MVC. ;Участие в проектах по разработке интеграционных и BPM-решений, систем документооборота на базе Java EE. Участие в проектировании архитектуры информационных...;"Java;Java EE;Java Servlets;REST;Spring Framework;SOAP;SQL;MVC";1;0;0;0;0;0;0;1;0;0;1;0;0;1;0;0;0;1;1;0;1;0;0;0;0;0;0;1
24;74;34180109;Java Developer;Челябинск;3;5;NAUMEN;0.03333333333333333;"Naumen – один из IT-лидеров в России*. С 2001 года мы разрабатываем и внедряем интеллектуальные системы и сервисы, которые приносят пользу бизнесу и государству в реальной жизни, а не «на бумаге». Нашими ИТ-продуктами пользуются крупнейшие компании России, входящие в топ-500, из разных отраслей: энергетика, финансовый сектор, телекоммуникации, промышленность, ритейл и госструктуры. Мы амбициозны и не останавливаемся на достигнутом: ежегодно оборот Naumen растет на 30%, количество сотрудников увеличивается на 17%, открываются новые офисы компании. * ТОП-10 крупнейших разработчиков ПО по числу инсталляций в РФ (по версии TAdviser), разработчик №1 в России в сегменте аутсорсинговых контакт-центров (по версии iKS-Consulting) и входим в ТОП-10 IT-работодателей России (по версии HeadHunter). Российская динамично развивающаяся компания Naumen – ведущий разработчик и поставщик ИТ-решений для бизнеса и органов власти – приглашает на работу Java Developer в команду разработки Naumen Service Desk. Программный продукт Naumen Service Desk предназначен для автоматизации процессов управления ИТ и сервисным обслуживанием на предприятиях. С помощью Naumen Service Desk наши клиенты реализуют сервисную модель управления в ИТ-подразделениях и других внутренних службах, а также используют все преимущества сервисного подхода при оказании услуг клиентам компании. Нашими клиентами являются ИнтерРАО ЕС, Минкомсвязь России, Мираторг, Кари, Госуслуги и многие другие. Также Naumen Service Desk - обладатель международного сертификата PinkVERIFY. У нас:  современные технологии (Java 8, Spring, Hibernate, HTML5 и др.); удобные инструменты и инфраструктурные процессы (Git, Maven, Scrum, непрерывная интеграция: Jenkins; автоматизированное и нагрузочное тестирование: JUnit, Selenium); интересные задачи: расширение функциональности платформы, горизонтальное масштабирование, графическое представление объектов и их связей, разработка архитектурных решений, повышение usability web-интерфейса и др.; сотни внедрений в компаниях по всей России и странам СНГ. Выход на мировой рынок. Среди наших клиентов: Газпром, Сбербанк, Транснефть, СКБ-Банк, Тинькофф, LSR, СО ЕЭС, Интер РАО и многие другие.  У Вас:  опыт разработки на объектно-ориентированном языке (Java, C#, C++, Python или др.) от 1 года; желательно знание шаблонов проектирования приложений; опыт работы с реляционными базами данных; понимание структуры бизнес – приложений; дружелюбие (работа в команде); креативность (поиск новых решений, не бояться сложностей); ответственность (довести дело до конца); клиентоориентированность (желание найти решение, которое удовлетворит и клиента, и нас).  Вам в помощь:  команда: дружный коллектив разработчиков, тестировщиков и аналитиков; роботы: десятки серверов во главе с сервером непрерывной интеграции для автоматизированного тестирования и проверок кода; обучение за счет средств компании: конференции, семинары, учебные курсы, литература.  В Naumen мы создали все условия для продуктивной и интересной работы:  индивидуально обсуждаем с каждым кандидатом зарплатные ожидания; лояльный график работы и минимум бюрократии; работа в команде профессионалов в атмосфере взаимопомощи и поддержки; реальная возможность влиять на развитие и качество продукта; возможность профессионального обучения за счет компании; мы поддерживаем развитие ИТ-сообщества и обмен опытом: участвуем во внешних и внутренних конференциях не только в качестве слушателя, но и в качестве спикера, обучаем школьников и студентам программированию, проводим собственные образовательные программы; практикуем индивидуальное планирование карьеры, Performance Review 2 раза в год (80% ключевых сотрудников компании выросли внутри Naumen); заботимся о здоровье наших сотрудников:  ДМС сразу после испытательного срока: посещение специалистов в лучших поликлиниках и стоматологиях города, вызов врача на дом, госпитализация, телемедицина; полис выезжающих за рубеж (покрытие весь мир); вакцинация от гриппа;   насыщенная корпоративная жизнь компании: яркие корпоративы, поздравления с календарными и профессиональными праздниками. Подарки в честь значимых событий в жизни сотрудников: рождение ребенка, свадьба, подарки детям на Новый год; возможна частичная компенсация занятий спортом; современный и комфортный офис (самый центр города, БЦ Челябинск-СИТИ), кафе на территории бизнес-центра, в офисе оборудована мини-кухня, всегда в наличии разнообразные перекусы. ";;Опыт разработки на объектно-ориентированном языке (Java, C#, C++, Python или др.) от 1 года. Желательно знание шаблонов проектирования приложений. ;Команда: дружный коллектив разработчиков, тестировщиков и аналитиков. Роботы: десятки серверов во главе с сервером непрерывной интеграции для автоматизированного тестирования и...;"Java;Spring Framework;PostgreSQL;SQL;HTML";0;1;0;0;0;0;0;1;0;0;1;0;0;1;0;0;0;1;1;1;1;1;0;0;0;0;0;0
