;Index;id;name;city;min_salary;max_salary;company;days_from_publication;description;conditions;requirement;responsibility;key_skills;Тюмень;Челябинск;Казань;Екатеринбург;Другие города;experience_Более 6 лет;experience_Нет опыта;experience_От 1 года до 3 лет;experience_От 3 до 6 лет;schedule_Гибкий график;schedule_Полный день;schedule_Сменный график;schedule_Удаленная работа;employment_Полная занятость;employment_Проектная работа;employment_Стажировка;employment_Частичная занятость;Java;Spring Framework;PostgreSQL;SQL;HTML;Git;Intellij IDEA;JavaScript;JDBC;ООП;Другие навыки
6;58;34248086;Senior Java-разработчик;Новосибирск;0;0;SEC corp;0.03333333333333333;Японской компании требуется опытный java-разработчик на постоянную основу для удаленной работы над нашими собственными проектами SMS-маркетинга на японском рынке (не игры, не финансы, не гос. проекты). Работа ведется уже более 10 лет, большая часть команды территориально расположена в Беларуси и России. Нашими разработками ежедневно пользуются многие ведущие компании Японии, мы используем только java в работе. Если вам интересна долгосрочная, высокооплачиваемая, стабильная удаленная работа, и вы - профессионал java, плюс вас не пугают высоконагруженные enterprise-grade системы, то у нас есть, что предложить. Ожидания от кандидата:  Опыт использования Spring, Hibernate Желателен опыт работы с Redis, Postgres Опыт разработки на Angular будет плюсом Знание английского языка – чтение, письмо (разговорный не обязателен) Желание работать качественно, мотивированность к саморазвитию Готовность работать в небольшой команде, где всегда видны результаты работы Условия:  Достойно высокий уровень оплаты Удаленная работа в полностью русскоязычной команде разработки 4 недели оплачиваемого отпуска в году Ежегодные бонусы, регулярный пересмотр уровня оплаты по результатам работы, поездки в Токио Непроектная, долговременная работа Перспективы роста Интересная работа и лучшая команда ;  Достойно высокий уровень оплаты Удаленная работа в полностью русскоязычной команде разработки 4 недели оплачиваемого отпуска в году Ежегодные бонусы, регулярный пересмотр уровня оплаты по результатам работы, поездки в Токио Непроектная, долговременная работа Перспективы роста Интересная работа и лучшая команда ;Опыт использования Spring, Hibernate. Желателен опыт работы с Redis, Postgres. Опыт разработки на Angular будет плюсом. Знание английского языка – чтение...;;"Java;Spring Framework;PostgreSQL;SQL;HTML";0;0;0;0;1;1;0;0;0;0;0;0;1;1;0;0;0;1;1;1;1;1;0;0;0;0;0;0
7;49;34197386;Программист-разработчик Java EE;Казань;2;3;Калейдоплан;0.13333333333333333;В компанию - резидент IT Park Казань требуется программист Java EE. Обязанности: Участие в работе над проектом. Проект - система онлайн проектирования домов. Подробности при личном общении. Требования: ​​​​​​Уверенные навыки разработки клиент серверных систем. JS. Желателен опыт работы с 3D. Условия: ​​​​​​Оклад + премия за соблюдение дедлайнов.; ​​​​​​Оклад + премия за соблюдение дедлайнов.;Уверенные навыки разработки клиент серверных систем. JS. Желателен опыт работы с 3D.;Участие в работе над проектом. Проект - система онлайн проектирования домов.;"Java;Git;SQL;JavaScript";0;0;1;0;0;0;0;0;1;0;1;0;0;1;0;0;0;1;0;0;1;0;1;0;1;0;0;0
8;66;34034872;Java-программист;Челябинск;2;5;ЧЕЛЯБИНВЕСТБАНК;0.03333333333333333;"Уважаемые соскатели! Для максимально быстрого рассмотрения вашего резюме к отклику прилагайте образцы исходных текстов.  Обязанности:  Разработка программного обеспечения; Написание микросервисов и сервисов в рамках серверов приложений.  Требования:  Знание Java (Eclipse, IDEA), JDBC, SQL; Опыт написания серверных java-приложений или сервлетов; Опыт работы с какой-либо системой контроля версий (svn, cvs, git); Опыт работы с клиент-серверными базами данных; Понимание работы *NIX-систем; Готовность к сопровождению унаследованного кода, умение тестировать собственнный код; Знания сетевых протоколов и настройки терминального доступа.  Условия:  Сильная команда профессионалов; Программа обучения и наставничества; Социальный пакет:  - Премирование сотрудников Банка (ежемесячное и дополнительное); - ДМС; - Бесплатное медицинское обслуживание сотрудников в медицинской службе Банка; - Организация питания сотрудников по льготным ценам в столовой Банка; - Дополнительные оплачиваемые дни отпуска; - Материальная поддержка сотрудников Банка за счет Банка и профсоюзной организации Банка; - Организация корпоративных мероприятий ко дню Банка и другим праздникам; - Подарки к праздникам сотрудникам Банка и их детям; - Посещение бассейна, спортзала, покупка билетов в театр, кино на льготных условиях; - Частичная компенсация стоимости путевок в детские оздоровительные и спортивные лагеря; - Присвоение почетных званий и памятных знаков с выделением материального поощрения в связи с награждением сотрудников Банка.  5-дневная рабочая неделя; Официальное трудоустройство. ";"  Сильная команда профессионалов; Программа обучения и наставничества; Социальный пакет:  - Премирование сотрудников Банка (ежемесячное и дополнительное); - ДМС; - Бесплатное медицинское обслуживание сотрудников в медицинской службе Банка; - Организация питания сотрудников по льготным ценам в столовой Банка; - Дополнительные оплачиваемые дни отпуска; - Материальная поддержка сотрудников Банка за счет Банка и профсоюзной организации Банка; - Организация корпоративных мероприятий ко дню Банка и другим праздникам; - Подарки к праздникам сотрудникам Банка и их детям; - Посещение бассейна, спортзала, покупка билетов в театр, кино на льготных условиях; - Частичная компенсация стоимости путевок в детские оздоровительные и спортивные лагеря; - Присвоение почетных званий и памятных знаков с выделением материального поощрения в связи с награждением сотрудников Банка.  5-дневная рабочая неделя; Официальное трудоустройство. ";Знание Java (Eclipse, IDEA), JDBC, SQL. Опыт написания серверных java-приложений или сервлетов. Опыт работы с какой-либо системой контроля...;Разработка программного обеспечения. Написание микросервисов и сервисов в рамках серверов приложений.;"Java;SVN;SQL;MS SQL;JDBC;Eclipse;Intellij IDEA;Git";0;1;0;0;0;0;0;1;0;0;1;0;0;1;0;0;0;1;0;0;1;0;1;1;0;1;0;1
9;73;34034843;Junior Java developer;Челябинск;2;5;ЧЕЛЯБИНВЕСТБАНК;0.03333333333333333;"Уважаемые соискатели! Для максимально быстрого рассмотрения вашего резюме к отклику на вакансию прикрепляйте образцы исходных текстов. Обязанности:  Разработка программного обеспечения; Написание микросервисов и сервисов в рамках серверов приложений.  Требования:  Знание Java (Eclipse, IDEA), JDBC, SQL; Опыт написания серверных java-приложений или сервлетов; Опыт работы с какой-либо системой контроля версий (svn, cvs, git); Опыт (возможно начальный) работы с клиент-серверными базами данных; Понимание работы *NIX-систем; Готовность к сопровождению унаследованного кода, умение тестировать собственнный код; Знания сетевых протоколов и настройки терминального доступа.  Условия:  Сильная команда профессионалов; Программа обучения и наставничества; Социальный пакет:  - Премирование сотрудников Банка (ежемесячное и дополнительное); - ДМС; - Бесплатное медицинское обслуживание сотрудников в медицинской службе Банка; - Организация питания сотрудников по льготным ценам в столовой Банка; - Дополнительные оплачиваемые дни отпуска; - Материальная поддержка сотрудников Банка за счет Банка и профсоюзной организации Банка; - Организация корпоративных мероприятий ко дню Банка и другим праздникам; - Подарки к праздникам сотрудникам Банка и их детям; - Посещение бассейна, спортзала, покупка билетов в театр, кино на льготных условиях; - Частичная компенсация стоимости путевок в детские оздоровительные и спортивные лагеря; - Присвоение почетных званий и памятных знаков с выделением материального поощрения в связи с награждением сотрудников Банка.  5-дневная рабочая неделя; Официальное трудоустройство. ";"  Сильная команда профессионалов; Программа обучения и наставничества; Социальный пакет:  - Премирование сотрудников Банка (ежемесячное и дополнительное); - ДМС; - Бесплатное медицинское обслуживание сотрудников в медицинской службе Банка; - Организация питания сотрудников по льготным ценам в столовой Банка; - Дополнительные оплачиваемые дни отпуска; - Материальная поддержка сотрудников Банка за счет Банка и профсоюзной организации Банка; - Организация корпоративных мероприятий ко дню Банка и другим праздникам; - Подарки к праздникам сотрудникам Банка и их детям; - Посещение бассейна, спортзала, покупка билетов в театр, кино на льготных условиях; - Частичная компенсация стоимости путевок в детские оздоровительные и спортивные лагеря; - Присвоение почетных званий и памятных знаков с выделением материального поощрения в связи с награждением сотрудников Банка.  5-дневная рабочая неделя; Официальное трудоустройство. ";Знание Java (Eclipse, IDEA), JDBC, SQL. Опыт написания серверных java-приложений или сервлетов. Опыт работы с какой-либо системой контроля...;Разработка программного обеспечения. Написание микросервисов и сервисов в рамках серверов приложений.;"Java;SVN;SQL;MS SQL;JDBC;Eclipse;Intellij IDEA;Git";0;1;0;0;0;0;0;1;0;0;1;0;0;1;0;0;0;1;0;0;1;0;1;1;0;1;0;1
10;96;34201470;Java-программист;Челябинск;2;5;Центр Информационных Технологий;0.13333333333333333;"Компания Центр Информационных Технологий приглашает java-программистов для разработки информационных систем Мы рассматриваем как опытных кандидатов, так и начинающих карьеру специалистов, с возможностью работать по гибкому графику. Мы ожидаем от кандидата:  Знание Java; Опыт работы с СУБД; Умение анализировать ранее разработанный код.  Будет плюсом:  Знание Spring Framework, Hibernate ORM; Опыт разработки web приложений (HTML, CSS, JavaScript); Опыт работы с СУБД  Мы предлагаем:  Достойная заработная плата; Работа в команде профессионалов высокого уровня, условия для профессионального и личного развития; Оформление по ТК РФ. ";"  Достойная заработная плата; Работа в команде профессионалов высокого уровня, условия для профессионального и личного развития; Оформление по ТК РФ. ";Знание Java. Опыт работы с СУБД. Умение анализировать ранее разработанный код. Будет плюсом: Знание Spring Framework, Hibernate ORM. ;;"Java;HTML;CSS;Spring Framework;PostgreSQL;Hibernate ORM;СУБД";0;1;0;0;0;0;0;1;0;1;0;0;0;1;0;0;0;1;1;1;0;1;0;0;0;0;0;1
11;90;34242378;Программист Java Middle;Новосибирск;4;0;БизнесКомпьютер;0.06666666666666667;"Обязанности:  Развитие одного из самых перспективных программных продуктов федерального уровня: система ОНКОР (https://онко-нет.рф/); Использование современных технологий программирования.  Требования:  Java Middle Приветствуется знание kotlin, опыт работы с postgre, git, intellij idea  Условия:  Оформление в соответствии с ТК РФ Работа в динамично развивающейся компании, выходящей на федеральный уровень Район УПИ Заработная плата официальная ";  Оформление в соответствии с ТК РФ Работа в динамично развивающейся компании, выходящей на федеральный уровень Район УПИ Заработная плата официальная ;Приветствуется знание kotlin, опыт работы с postgre, git, intellij idea.;Java Middle.;"Java;PostgreSQL;Git;ООП;XML;HTML;Intellij IDEA";0;0;0;0;1;0;0;0;1;0;0;0;1;1;0;0;0;1;0;1;0;1;1;1;0;0;1;1
12;18;33804255;Java-программист;Тюмень;4;4;Стабильный Программный Код;0.9333333333333333;Обязанности:  Доработка и сопровождение серверной части системы приема платежей от населения Разработка и сопровождение серверной части мобильного кошелька  Требования:  Знание основных фреймворков SpringFramework, Hibernate, SpringBoot, Vaadin Принципы сетевого взаимодействия, сетевые протоколы HTTP/HTTPS, XMPP, AMQP Основы микросервисов, виртуализация на базе Docker (docker-compose) CI/CD на базе GitLab Английский письменный (обязательно !!!)  Условия:  Полный рабочий день Белая зарплата Работа в офисе в центре города Небольшой коллектив ;  Полный рабочий день Белая зарплата Работа в офисе в центре города Небольшой коллектив ;Знание основных фреймворков SpringFramework, Hibernate, SpringBoot, Vaadin. Принципы сетевого взаимодействия, сетевые протоколы HTTP/HTTPS, XMPP, AMQP. Основы микросервисов, виртуализация на...;Доработка и сопровождение серверной части системы приема платежей от населения. Разработка и сопровождение серверной части мобильного кошелька.;"Java;Spring Framework;PostgreSQL;SQL;HTML";1;0;0;0;0;0;0;0;1;0;1;0;0;1;0;0;0;1;1;1;1;1;0;0;0;0;0;0
13;21;34242381;Программист Java Middle;Челябинск;4;5;БизнесКомпьютер;0.06666666666666667;"Обязанности:  Развитие одного из самых перспективных программных продуктов федерального уровня: система ОНКОР (https://онко-нет.рф/); Использование современных технологий программирования.  Требования:  Java Middle Приветствуется знание kotlin, опыт работы с postgre, git, intellij idea  Условия:  Оформление в соответствии с ТК РФ Работа в динамично развивающейся компании, выходящей на федеральный уровень Район УПИ Заработная плата официальная ";  Оформление в соответствии с ТК РФ Работа в динамично развивающейся компании, выходящей на федеральный уровень Район УПИ Заработная плата официальная ;Приветствуется знание kotlin, опыт работы с postgre, git, intellij idea.;Java Middle.;"Java;PostgreSQL;Git;ООП;XML;HTML;Intellij IDEA";0;1;0;0;0;0;0;0;1;0;0;0;1;1;0;0;0;1;0;1;0;1;1;1;0;0;1;1
